Perfume,Similar Perfumes
Mandarava Extrait de Parfum,"Thichila Eau de Parfum, Coup de Foudre Eau de Parfum, Diaghilev Extrait de Parfum, Homa Parfum, L'Aimee Eau de Parfum"
Ma Nishtana Extrait de Parfum,"Haxan Eau de Parfum, Mysterious Oud Extrait de Parfum, Al Oudh Eau de Parfum, 20 Mars 2022 Eau de Parfum, Parisian Oud Eau de Parfum"
Thichila Eau de Parfum,"Mandarava Extrait de Parfum, Homa Parfum, Trayee Eau de Parfum, Mohragot Eau de Parfum, Camel Extrait de Parfum"
Mohragot Eau de Parfum,"Thichila Eau de Parfum, Trayee Eau de Parfum, Mandarava Extrait de Parfum, Vetiver Nocturne Autumn 19 Extrait de Parfum, Homa Parfum"
Tiwa Eau de Parfum,"Oliver Eau de Parfum, Salted Green Mango Eau de Parfum, Trayee Eau de Parfum, Tom Yum Eau de Parfum, Velvet Splendour Perfume Concentrate"
Tom Yum Eau de Parfum,"Tiwa Eau de Parfum, Cologne Absolute Eau de Parfum, Moss Cologne Eau de Parfum, Mohragot Eau de Parfum, Villa Nellcote Eau de Parfum"
Natsumeku Eau de Parfum,"Oliver Eau de Parfum, Kolonya Eau de Toilette, L'Aimee Eau de Parfum, Splendiris Eau de Parfum, Neroli Portofino Travel Atomizer"
Maruyama Eau de Parfum,"Elysium Parfum Cologne, Vetiver Parfum Cologne, Gosha Rubchinskiy Eau de Toilette, 2 Candle, 2 Eau de Parfum"
If by RK Eau de Parfum,"21 Eau de Parfum, Coup de Foudre Eau de Parfum, Lyric for Women Eau de Parfum, Mon Nom Est Rouge Eau de Parfum, Lumiere Blanche Eau de Parfum"
Musc Moschus Eau De Parfum,"L'Aimee Eau de Parfum, Manteuse Eau de Parfum, Black IV Parfum Extrait, Chameleon Eau de Parfum, King Of Flowers Extrait de Parfum"
War and Peace II Extrait de Parfum,"Mon Nom Est Rouge Eau de Parfum, Liwa Eau de Parfum, Rudis Eau de Parfum, Lucid Dream Eau de Parfum, Tokyo Eau de Parfum"
Ummo Eau de Parfum,"Fumerie Turque Eau de Parfum, Wode Eau de Parfum, French Bouquet Eau de Parfum, Oshun Extrait de Parfum, New York Eau de Parfum"
What About Pop Eau de Parfum,"Mohur Eau de Parfum, Enchanted Forest Eau de Parfum, Platino, L'Aimee Eau de Parfum, Mandarava Extrait de Parfum"
Dendera Extrait de Parfum,"L'Aimee Eau de Parfum, Trayee Eau de Parfum, 20 Mars 2022 Eau de Parfum, Medullary-ray Eau de Parfum, Thichila Eau de Parfum"
Gaea Eau de Parfum,"New York Eau de Parfum, Jubilation XXV Eau de Parfum, Oliver Eau de Parfum, Meraki Eau de Parfum, Scandal Parfum Cologne"
Mile High Eau de Parfum,"Gheorghe Eau de Parfum, Pineapple Essenza Eau de Parfum, Puritas Eau de Parfum, Citrus Riviera Eau de Parfum, French Bouquet Eau de Parfum"
Milano Cento Deodorant Stick,"Milano Cento For Him Eau de Toilette, Scandal Parfum Cologne, Knize Forest Eau de Toilette, Haxan Eau de Parfum, Kolonya Eau de Toilette"
Telegrama Eau de Parfum,"Sartorial Eau de Toilette, Velvet Fantasy Eau de Parfum, Bois Dore Eau de Parfum, Santal Eau de Toilette, 1681 Eau de Parfum"
Koiame Eau de Parfum,"Villa Nellcote Eau de Parfum, Two Eau de Toilette, Elixir Pour Femme Extrait de Parfum, Jardin Exclusif Eau de Parfum, Halfeti Eau de Parfum"
Hakka Eau de Parfum,"Koiame Eau de Parfum, Royal Elixir Parfum, Ambre Royal Eau de Parfum, Ambra Calabria Extrait de Parfum, 1962 Eau de Parfum"
Wood Flake Eau de Parfum,"Taklamakan Eau de Parfum, Camel Extrait de Parfum, Amber Room Eau de Parfum, Fortis Eau de Parfum, Halfeti Eau de Parfum"
Divine Vanille Eau de Parfum,"Mon Nom Est Rouge Eau de Parfum, 21 Eau de Parfum, Taklamakan Eau de Parfum, 20 Mars 2022 Eau de Parfum, Haxan Eau de Parfum"
Acqua di Scandola Eau de Parfum,"Bois Lumiere Eau de Parfum, L'Homme Sage Eau de Parfum, JF Eau de Toilette, Jardin du Poete Eau de Toilette, Jubilation XXV Eau de Parfum"
Bee Extrait de Parfum,"L'Aimee Eau de Parfum, Majaina Sin Eau de Parfum, 21 Eau de Parfum, Gheorghe Eau de Parfum, Coup de Foudre Eau de Parfum"
Majaina Sin Eau de Parfum,"Vixere Eau de Parfum, Noir Exquis Eau de Parfum, Interlude Woman, Camel Extrait de Parfum, Versilia Aurum Eau de Parfum"
Mxxx. Extrait de Parfum,"Mx. Eau de Parfum, Ani Extrait de Parfum, 20 Mars 2022 Eau de Parfum, Trayee Eau de Parfum, Gold Extrait de Parfum"
Meraki Eau de Parfum,"Qatar Extrait de parfum, Diaghilev Extrait de Parfum, Two Eau de Toilette, New York Eau de Parfum, 20 Mars 2022 Eau de Parfum"
Lust in Paradise X Reine Paradis Eau de Parfum,"Lust In Paradise Eau de Parfum, New York Eau de Parfum, Squid Extrait de Parfum, Kolonya Eau de Toilette, MEM Eau de Parfum"
Copper Eau de Parfum,"Sartorial Eau de Toilette, Enchanted Forest Eau de Parfum, Hili Eau de Parfum, Mon Nom Est Rouge Eau de Parfum, Trayee Eau de Parfum"
Gold Extrait de Parfum,"L'Aimee Eau de Parfum, New York Eau de Parfum, Mxxx. Extrait de Parfum, Diaghilev Extrait de Parfum, PHI Une Rose de Kandahar Eau de Parfum"
Atlas Fever Eau de Parfum,"Mon Nom Est Rouge Eau de Parfum, Oud Wood Travel Atomizer, Oud Wood Body Spray Scented Body Spray, Oud Wood Eau de Parfum, 20 Mars 2022 Eau de Parfum"
Re-Charge Black Pepper Deodorant Stick,"L'homme infini Eau de Parfum, Oliver Eau de Parfum, Plein Jeu III-V Extrait de Parfum, Nuwa Extrait de Parfum, Sartorial Eau de Toilette"
Hedonist Absolute Eau de Parfum,"Hedonist Eau de Parfum, Salome Eau de Parfum, Comme Un Carrousel Eau de Parfum, 20 Years Eau de Parfum, Freeway Eau de Parfum"
Hedonist Iris Absolute Eau de Parfum,"Lil Fleur Eau de Parfum, Silver Ombre Eau de Parfum, Mohur Extrait Parfum Extrait, Soleil de Jeddah Eau de Parfum, Kasbah Eau de Parfum"
Hedonist Rose Absolute Eau de Parfum,"Nemer Eau de Parfum, Oud Noir Intense Eau de Parfum, Sahraa Oud Eau de Parfum, Mohur Extrait Parfum Extrait, Mon Nom Est Rouge Eau de Parfum"
Patchouli in Perfumery Magazine,"Delma Eau de Parfum, Mohur Extrait Parfum Extrait, Mon Nom Est Rouge Eau de Parfum, Patchouli Argent Eau de Parfum, Black Gold Eau de Parfum"
Le Pavillon d'Or Eau de Parfum,"Ashoka Eau de Parfum, Medullary-ray Eau de Parfum, Elixir Pour Femme Extrait de Parfum, Nordic Noir, Dia Woman Eau de Parfum"
Les Annees 25 Bis Eau de Parfum,"Diaghilev Extrait de Parfum, L'Aimee Eau de Parfum, Nuwa Extrait de Parfum, Bijou Romantique Eau de Parfum, Gin Fizz Eau de Toilette"
Odeur Du Theatre Du Chatelet Acte 1 Eau de Toilette,"Magenta Pop Eau de Parfum, Kolonya Eau de Toilette, Altruist Eau de Parfum, Bois d'Oud Eau de Parfum, Oud Luban Attar / perfume oil"
Zdravetz Eau de Parfum,"Elysium Pour Homme Extrait de Parfum, Halfeti Eau de Parfum, Perdizione Eau de Parfum, Tyrannosaurus Rex Extrait de Parfum, Grisette Eau de Parfum"
Corpse Reviver Eau de Parfum,"Camel Extrait de Parfum, Orchidee Vanille Eau de Parfum, Escentric 05 - Travel Spray Eau de Toilette, Anti-Blues, Poudrextase Eau de Parfum"
Elysium Parfum Cologne,"Vetiver Parfum Cologne, Scandal Parfum Cologne, Elysium Pour Homme Extrait de Parfum, Coup de Foudre Eau de Parfum, Danger Parfum Cologne"
Creation-E Parfum Cologne,"Scandal Parfum Cologne, Ani Extrait de Parfum, Oliver Eau de Parfum, Qatar Extrait de parfum, Empressa Eau de Toilette"
Danger Parfum Cologne,"Scandal Parfum Cologne, Elysium Pour Homme Extrait de Parfum, Diaghilev Extrait de Parfum, 20 Mars 2022 Eau de Parfum, Coup de Foudre Eau de Parfum"
Scandal Parfum Cologne,"Danger Parfum Cologne, Elysium Pour Homme Extrait de Parfum, 1872 for Women Eau de Parfum, 20 Mars 2022 Eau de Parfum, Coup de Foudre Eau de Parfum"
Vetiver Parfum Cologne,"Elysium Parfum Cologne, Scandal Parfum Cologne, Elysium Pour Homme Extrait de Parfum, Coup de Foudre Eau de Parfum, Danger Parfum Cologne"
La Capitale Parfum,"Aoud Exclusif Eau de Parfum, Qatar Extrait de parfum, Diaghilev Extrait de Parfum, Ardent Eau de Parfum, Interlude Woman"
SpeM PetraM Eau de Parfum,"Young Hearts Eau de Parfum, New York Intense Eau de Parfum, Upper Ten Eau de Parfum, Enchanted Forest Eau de Parfum, Saringkarn Extrait"
Oud Maximus Autumn 19 Extrait de Parfum,"Coup de Foudre Eau de Parfum, Mysterious Oud Extrait de Parfum, Amber Cologne Eau de Parfum, Oud Monarch Extrait de Parfum, Oud Sinharaja Extrait de Parfum"
Vetiver Nocturne Autumn 19 Extrait de Parfum,"Vetiver Nocturne Absolu Extrait de Parfum, Mandarava Extrait de Parfum, Mohragot Eau de Parfum, L'Heure Exquise 2020 Extrait de Parfum, L'Aimee Eau de Parfum"
Love Mimosa Eau de Parfum,"Elixir Pour Femme Extrait de Parfum, Heliotrope Eau de Parfum, Dia Woman Eau de Parfum, Interlude Black Iris Eau de Parfum, Dolceacqua Eau de Parfum"
Female Christ Eau de Parfum,"Oriental Leather Eau de Parfum, Gold Extrait de Parfum, Creation-E Parfum Cologne, Danger Parfum Cologne, Elixir Pour Femme Extrait de Parfum"
Atomic Rose Eau de Parfum,"New York Eau de Parfum, Coup de Foudre Eau de Parfum, Oud Maximus Autumn 19 Extrait de Parfum, Mysterious Oud Extrait de Parfum, Gold Incense Eau de Parfum"
Mizunara Eau de Parfum,"Haxan Eau de Parfum, Oliver Eau de Parfum, Milano Cento Deodorant Stick, Milano Cento For Him Eau de Toilette, Russian Leather Eau de Parfum"
Fall Into Stars Eau de Parfum,"Coup de Foudre Eau de Parfum, Amber Intense Eau de Parfum, Rhodanthe Eau de Parfum, Oud Maximus Autumn 19 Extrait de Parfum, Ani Extrait de Parfum"
Chypre-Siam Eau de Toilette,"Diaghilev Extrait de Parfum, Mandarava Extrait de Parfum, Amber Aoud Extrait de Parfum, Homa Parfum, MEM Eau de Parfum"
Tabac Vert Eau de Toilette,"Kolonya Eau de Toilette, Eau My Soul Eau de Parfum, New York Eau de Parfum, Hili Eau de Parfum, Panthea Eau de Parfum"
Mousse Illuminee Eau de Toilette,"Forest Eau de Parfum, White Madera Eau de Parfum, Macaque Eau de Parfum, Halfeti Eau de Parfum, Godolphin Eau de Parfum"
40 Rogue Eau de Toilette,"Enchanted Forest Eau de Parfum, Two Eau de Toilette, Black Beard Extrait de Parfum, Fougere L'Aube Eau de Toilette, Arabesque Attar / Perfume Oil"
Derviche Eau de Toilette,"Diaghilev Extrait de Parfum, 20 Mars 2022 Eau de Parfum, Milano Eau de Parfum, Tyrannosaurus Rex Extrait de Parfum, Halfeti Eau de Parfum"
Radish x Vetiver Eau de Parfum,"Fortis Eau de Parfum, Kagiroi Parfum, New York Eau de Parfum, Gaiac Eau de Parfum, Nio Eau de Parfum"
Chlorophyll x Gardenia Eau de Parfum,"Arsalan Parfum, Love Toxin Extrait de Parfum, Oud Jaune Intense Eau de Parfum, Queen Of The Night Eau de Parfum, Gardenia Eau de Parfum"
Celluloid x Galbanum Eau de Parfum,"Homa Parfum, Sel d'Argent Eau de Parfum, Purple Fig Eau de Parfum, Morning Chess Eau de Parfum, Young Hearts Eau de Parfum"
Soleil Neige Eau de Parfum,"Fleur de Portofino Eau de Parfum, Neroli Portofino Travel Atomizer, Sole di Positano Eau de Parfum, Neroli Portofino Eau de Parfum, Santal Blush Eau de Parfum"
Wonder Of You Eau de Parfum,"Jardin du Poete Eau de Toilette, Escentric 04 - Travel Spray Eau de Toilette, Elysium Pour Homme Extrait de Parfum, Oud Stars - Indochine Parfum, Goddess of Love & Perfume Parfum Extrait"
Riviera Drive Eau de Parfum,"Haxan Eau de Parfum, Sedley Eau de Parfum, Enchanted Forest Eau de Parfum, Knize Ten Eau de Toilette, Mon Nom Est Rouge Eau de Parfum"
Pomelo Riviera Eau de Parfum,"Oliver Eau de Parfum, Shaft of Light Eau de Parfum, Kolonya Eau de Toilette, Tart's Knicker Drawer Eau de Parfum, Sel d'Argent Eau de Parfum"
Riviera Lazuli Eau de Parfum,"Haxan Eau de Parfum, Bois Lumiere Eau de Parfum, Eau De Parfum Eau de Parfum, Sancti Eau de Parfum, Itasca Eau de Parfum"
Yoyogi Eau de Toilette,"Haxan Eau de Parfum, The Time Eau de Parfum, Mriga Parfum, Oliver Eau de Parfum, Mizunara Eau de Parfum"
Chloe Sevigny Little Flower Eau de Parfum,"Violette in Love Eau de Toilette, Carduus Eau de Parfum, Glass Blooms Eau de Parfum, Enchanted Forest Eau de Parfum, Taklamakan Eau de Parfum"
Baie 19 Eau de Parfum,"New York Eau de Parfum, Against Nature Eau de Parfum, Taklamakan Eau de Parfum, B683 Eau de Parfum, Royal Elixir Parfum"
Across The Ocean Eau de Parfum,"Coup de Foudre Eau de Parfum, New York Eau de Parfum, Taklamakan Eau de Parfum, Rhodanthe Eau de Parfum, Velvet Amber"
Terrible Teddy Eau de Parfum,"Saringkarn Extrait, Thurible Eau de Parfum, Anti-Blues, Christopher Street Eau de Parfum, Tendre est la Nuit Eau de Parfum"
Heartless Helen Eau de Parfum,"Freeway Eau de Parfum, Aroon Sawat Eau de Parfum, Hisui (Jade) Eau de Parfum, Civet Extrait de Parfum, Marfa Eau de Parfum"
Plumeria de Orris Extrait de Parfum,"Ashoka Eau de Parfum, Trayee Eau de Parfum, Dendera Extrait de Parfum, La Belle Helene Eau de Parfum, Taklamakan Eau de Parfum"
Love Kills Eau de Parfum,"Rudis Eau de Parfum, Ambre Royal Eau de Parfum, Royal Elixir Parfum, Halfeti Eau de Parfum, Essence de Patchouli Eau de Parfum"
Oriental Leather Eau de Parfum,"Female Christ Eau de Parfum, Les Indes Galantes Eau de Parfum, Patchouli Intense Eau de Parfum, New York Eau de Parfum, Mohur Extrait Parfum Extrait"
Rolling in Love Eau de Parfum,"Platino, Arancia di Sicilia Eau de Parfum, Liquid Illusion Eau de Parfum, Feb. 14, 1912 Eau de Parfum, Sticky Cake Eau de Toilette"
Ambre Khandjar Eau de Parfum,"Ambre Cashmere Intense Eau de Parfum, Taklamakan Eau de Parfum, Gheorghe Eau de Parfum, MEM Eau de Parfum, Mohur Eau de Parfum"
Jardins de Misfah Eau de Parfum,"Nuit de Sable Eau de Parfum, Lost Cherry Eau de Parfum, Dolceacqua Eau de Parfum, Pichola Eau de Parfum, Ashoka Eau de Parfum"
Suma Oriental Eau de Parfum,"21 Eau de Parfum, If by RK Eau de Parfum, Scandal Parfum Cologne, 1885 Bains Sulfureux Eau de Parfum, Patchouli Absolu Eau de Parfum"
Mr. Vetiver Eau de Parfum,"Scandal Parfum Cologne, Ambre Topkapi Eau de Parfum, Trayee Eau de Parfum, Nio Eau de Parfum, Grace by Grace Coddington Eau de Toilette"
Fleur des Fleurs Eau de Parfum,"Coup de Foudre Eau de Parfum, Just Before Eau de Parfum, Halfeti Eau de Parfum, MEM Eau de Parfum, Oud Noir Intense Eau de Parfum"
Murmure des Dieux Eau de Parfum,"Chameleon Eau de Parfum, Civet Extrait de Parfum, Tihota Eau de Parfum, A Blvd. Called Sunset Eau de Parfum, Dolceacqua Eau de Parfum"
Bohemian Soul Eau de Parfum,"Rosa Nigra Extrait de Parfum, Celestial Eau de Parfum, Sandalo Nobile Eau de Parfum, Mortal Skin Eau de Parfum, Ashoka Eau de Parfum"
Memory Motel Eau de Parfum,"Christopher Street Eau de Parfum, Chimaera Extrait de Parfum, Panthea Eau de Parfum, Salome Eau de Parfum, Civet Extrait de Parfum"
Kalan Eau de Parfum,"Kolonya Eau de Toilette, Pas Ce Soir Eau de Parfum, Altruist Eau de Parfum, Oud Luban Attar / perfume oil, Azemour les Orangers Eau de Parfum"
Aventus Cologne Eau de Parfum,"L'Aimee Eau de Parfum, Lyric for Women Eau de Parfum, New York Eau de Parfum, Taklamakan Eau de Parfum, Mon Nom Est Rouge Eau de Parfum"
Harem Soiree Parfum,"Jubilation XXV Eau de Parfum, Petra Eau de Parfum, Dendera Extrait de Parfum, Incense Rose Eau de Parfum, Nocturnal Poetry Parfum"
Velvet Rouge,"Endymion Cologne, Magenta Pop Eau de Parfum, Oliver Eau de Parfum, Soleil d'Italie Eau de Parfum, Kolonya Eau de Toilette"
Bois Sacre Parfum,"Oud Noir Intense Eau de Parfum, Mohur Extrait Parfum Extrait, Coup de Foudre Eau de Parfum, Mriga Parfum, Dendera Extrait de Parfum"
Samharam Parfum,"Homa Parfum, Shihan Eau de Parfum, Petra Eau de Parfum, Mohragot Eau de Parfum, Io Non Ho Mani Che Mi Accarezzino il Volto Extrait de Parfum"
Sucre Noir Parfum,"Quilombo Eau de Parfum, Sugarwood Eau de Parfum, Mango Skin Eau de Parfum, Venom of Angel Eau de Parfum, Vaniglia Eau de Parfum"
Oeilleres Parfum Extrait,"Haxan Eau de Parfum, Sloth Extrait de Parfum, Cuir Mauresque Eau de Parfum, Oud Sublime Elixir de Parfum, Nocturnal Poetry Parfum"
Slow Dance Eau de Parfum,"Ambra Eau de Parfum ..., Carnicure (formerly L'animal sauvage) Eau de Parfum, Mon Nom Est Rouge Eau de Parfum, Gheorghe Eau de Parfum, Chameleon Eau de Parfum"
L'Air Des Alpes Suisses Eau de Parfum,"Scandal Parfum Cologne, Ambre Topkapi Eau de Parfum, Phtaloblue Eau de Parfum, Haxan Eau de Parfum, Russian Leather Eau de Parfum"
Not A Perfume Superdose Eau de Parfum,"Greek Keys Extrait de Parfum, Leopard Extrait de Parfum, Notorious Oud Eau de Parfum, Not a Perfume Eau de Parfum, Tihota Eau de Parfum"
La Couche du Diable Eau de Parfum,"Golden Moka Eau de Parfum, Petra Eau de Parfum, Mriga Parfum, Poem Of Damas Extrait de Parfum, Amber Intense Eau de Parfum"
Baikal Leather Intense Eau de Parfum,"Mohur Extrait Parfum Extrait, 20 Mars 2022 Eau de Parfum, Wode Eau de Parfum, Scandal Parfum Cologne, Aoud Exclusif Eau de Parfum"
Fucking Fabulous Travel Atomizer Eau de Parfum,"Fabulous Body Spray Scented Body Spray, Fabulous Eau de Parfum, Neroli Portofino Travel Atomizer, Patchouli Absolu Eau de Parfum, Oud Wood Travel Atomizer"
Corpi Caldi Eau de Parfum,"Vixere Eau de Parfum, L'Aimee Eau de Parfum, Kolonya Eau de Toilette, Love Toxin Extrait de Parfum, Moss Cologne Eau de Parfum"
Elae Eau de Parfum,"Tahiti Vanilla Parfum, Ambre Stone Eau de Parfum, The Decay Of The Angel Eau de Parfum, Pichola Eau de Parfum, Love Exposure Eau de Parfum"
Squid Extrait de Parfum,"Petra Eau de Parfum, Lust in Paradise X Reine Paradis Eau de Parfum, United Arab Emirates Aoud Extrait de Parfum, Shihan Eau de Parfum, 20 Mars 2022 Eau de Parfum"
Sir Winston Extrait de Parfum,"Coup de Foudre Eau de Parfum, Fusion Sacree - Obscur Eau de Parfum, Carduus Eau de Parfum, Dendera Extrait de Parfum, Mxxx. Extrait de Parfum"
Symphonie de Neroli Extrait de Parfum,"Coup de Foudre Eau de Parfum, Oud Maximus Autumn 19 Extrait de Parfum, Vetiver Nocturne Autumn 19 Extrait de Parfum, Diaghilev Extrait de Parfum, Pichola Eau de Parfum"
Zemfira Extrait de Parfum,"Coup de Foudre Eau de Parfum, Oud Maximus Autumn 19 Extrait de Parfum, Mysterious Oud Extrait de Parfum, Rhodanthe Eau de Parfum, Oliver Eau de Parfum"
Los Angeles Eau de Parfum,"Carduus Eau de Parfum, Moth Extrait de Parfum, Lys Noir Eau de Parfum, Wode Eau de Parfum, Vepres Siciliennes Eau de Parfum"
Keep Glazed Eau de Parfum,"Chameleon Eau de Parfum, Hummingbird Extrait de Parfum, Musk Aoud Extrait de Parfum, 2018 Roxo Tonic Eau de Parfum, Love Toxin Extrait de Parfum"
Ristretto Intense Cafe Extrait de Parfum,"Velvet Fantasy Eau de Parfum, Purple Haze Eau de Parfum, Coup de Foudre Eau de Parfum, Arabesque Attar / Perfume Oil, Kasbah Eau de Parfum"
Instant Crush Eau de Parfum,"L'Aimee Eau de Parfum, Sensual Instinct Eau de Parfum, Sweet Flowers Eau de Parfum, New York Eau de Parfum, Oud Noir Intense Eau de Parfum"
Labyrinth Of Spices Extrait de Parfum,"Kolonya Eau de Toilette, Mon Nom Est Rouge Eau de Parfum, Halfeti Eau de Parfum, Ambre Topkapi Eau de Parfum, Haxan Eau de Parfum"
Ottoman Treasure Extrait de Parfum,"Parisian Oud Eau de Parfum, New York Eau de Parfum, Chimaera Extrait de Parfum, Amber Room Eau de Parfum, 21 Eau de Parfum"
Royal Sapphire Extrait de Parfum,"Pas Ce Soir Eau de Parfum, Vixere Eau de Parfum, 1885 Bains Sulfureux Eau de Parfum, Azzurro di Capri Extrait Parfum Extrait, Bois d'Oud Eau de Parfum"
Kintsugi Eau de Parfum,"Incarnata Eau de Parfum, Rhodanthe Eau de Parfum, L'Aimee Eau de Parfum, Tart's Knicker Drawer Eau de Parfum, Taklamakan Eau de Parfum"
Osmanthus Elixir Parfum,"Osmanthus Eau de Parfum, 20 Mars 2022 Eau de Parfum, Koiame Eau de Parfum, Elysium Pour Homme Extrait de Parfum, Whisky Oud Parfum Concentration"
Isfarkand Elixir Parfum,"9mm Eau de Parfum, Geza Schoen Eau de Toilette, Soleil d'Italie Eau de Parfum, Escentric 04 - Travel Spray Eau de Toilette, I Don't Know What Eau de Parfum"
Ta'if Elixir Parfum,"Ta'if Eau de Parfum, Kolonya Eau de Toilette, Terra Mia Eau de Parfum, Forty Thieves Eau de Parfum, Mysterious Oud Extrait de Parfum"
Royal Elixir Parfum,"Ambre Royal Eau de Parfum, Halfeti Eau de Parfum, Vain & Naive Extrait de Parfum, L'Aimee Eau de Parfum, Bois d'Oud Eau de Parfum"
Ormonde Elixir Parfum,"Ormonde Woman Eau de Parfum, Mohur Eau de Parfum, Mohur Extrait Parfum Extrait, Trayee Eau de Parfum, Ormonde Man Eau de Parfum"
Tuscan Leather Travel Atomizer,"Tuscan Leather Eau de Parfum, Tuscan Leather Intense Eau de Parfum, Fucking Fabulous Travel Atomizer Eau de Parfum, Neroli Portofino Travel Atomizer, Noir de Noir Travel Atomizer"
Noir de Noir Travel Atomizer,"Noir de Noir Eau de Parfum, Oud Wood Travel Atomizer, Tobacco Vanille Travel Atomizer, Oud Wood Body Spray Scented Body Spray, Fleur de Portofino Eau de Parfum"
Cairo Eau de Parfum,"Taklamakan Eau de Parfum, Mon Nom Est Rouge Eau de Parfum, 20 Mars 2022 Eau de Parfum, Aoud Exclusif Eau de Parfum, Leather Patchouli Eau de Parfum"
Neroli Intense Eau de Parfum,"Cap Neroli Eau de Toilette, Empressa Eau de Toilette, Citrus Riviera Eau de Parfum, Black Beard Extrait de Parfum, Perdizione Eau de Parfum"
Brume du Matin Eau de Parfum,"Instant Crush Eau de Parfum, Hummingbird Extrait de Parfum, New York Eau de Parfum, L'Aimee Eau de Parfum, Koiame Eau de Parfum"
Cuir de Chine Eau de Parfum,"Fougere Emeraude Eau de Parfum, Bergamote de G. Franco Eau de Parfum, Iris Perle Eau de Parfum, Vetiver de Pierre Eau de Parfum, Jasmin de Cherifa Eau de Parfum"
Rose Millesimee Extrait de Parfum,"L'Aimee Eau de Parfum, Sheiduna Parfum Extrait, Aqaba Eau de Parfum, Dolceacqua Eau de Parfum, Silver Ombre Eau de Parfum"
Delina Hair Mist,"Delina Eau de Parfum, L'Aimee Eau de Parfum, Dendera Extrait de Parfum, Scandal Parfum Cologne, Tyrannosaurus Rex Extrait de Parfum"
Cuoio Dei Dolci Eau de Parfum,"MEM Eau de Parfum, Vixere Eau de Parfum, Gheorghe Eau de Parfum, L'Aimee Eau de Parfum, Promesse de l'Aube Eau de Parfum"
Notorious Oud Eau de Parfum,"Homa Parfum, MEM Eau de Parfum, Fougere L'Aube Eau de Toilette, Aurora Eau de Parfum, Arabesque Attar / Perfume Oil"
Metallique Eau de Parfum,"Velvet Fantasy Eau de Parfum, Tubereuse Imperiale Eau de Parfum, Explicite Eau de Parfum, 20 Mars 2022 Eau de Parfum, L'Aimee Eau de Parfum"
Fougere Emeraude Eau de Parfum,"Iris Perle Eau de Parfum, Cuir de Chine Eau de Parfum, Bergamote de G. Franco Eau de Parfum, Vetiver de Pierre Eau de Parfum, Jasmin de Cherifa Eau de Parfum"
Gentle fluidity Silver Eau de Parfum,"gentle Fluidity Gold Eau de Parfum, New York Eau de Parfum, Wode Eau de Parfum, Isra & Miraj Eau de Parfum, Silver Ombre Eau de Parfum"
gentle Fluidity Gold Eau de Parfum,"Gentle fluidity Silver Eau de Parfum, New York Eau de Parfum, Wode Eau de Parfum, Isra & Miraj Eau de Parfum, Silver Ombre Eau de Parfum"
Oriental Velours Eau de Parfum,"Trayee Eau de Parfum, Dendera Extrait de Parfum, Vanille d'Amine Eau de Parfum, Ashoka Eau de Parfum, L'Aimee Eau de Parfum"
Musk Cologne Eau de Parfum,"Coup de Foudre Eau de Parfum, Sicilian Wood Eau de Parfum, 1872 for Women Eau de Parfum, Jardin du Poete Eau de Toilette, Scandal Parfum Cologne"
Mandarino di Sicilia Eau de Parfum,"Kolonya Eau de Toilette, Cuir Mauresque Eau de Parfum, Azzurro di Capri Extrait Parfum Extrait, Upper Ten Eau de Parfum, Bergamote 22 Eau de Parfum"
Bergamotto di Calabria Eau de Parfum,"Kolonya Eau de Toilette, Love Eau de Parfum, Panthea Eau de Parfum, Oliver Eau de Parfum, Pichola Eau de Parfum"
Arancia di Sicilia Eau de Parfum,"Golden Moka Eau de Parfum, Shihan Eau de Parfum, New York Intense Eau de Parfum, Le Roi Empereur Eau de Parfum, Mon Nom Est Rouge Eau de Parfum"
Soleil d'Italie Eau de Parfum,"New York Eau de Parfum, Oliver Eau de Parfum, Villa Nellcote Eau de Parfum, Ani Extrait de Parfum, Kolonya Eau de Toilette"
Safran Colognise Extrait de Cologne,"Oliver Eau de Parfum, Elysium Pour Homme Extrait de Parfum, 20 Mars 2022 Eau de Parfum, Villa Nellcote Eau de Parfum, Chimaera Extrait de Parfum"
Le Chant de Camargue Eau de Parfum,"Hili Eau de Parfum, If by RK Eau de Parfum, Yawahada (Soft Skin) Eau de Parfum, Rouge Assassin, 21 Eau de Parfum"
Petales de Cashmere Eau de Parfum,"Halfeti Eau de Parfum, MEM Eau de Parfum, Vixere Eau de Parfum, Instant Crush Eau de Parfum, Gold Incense Eau de Parfum"
Tuscan Leather Intense Eau de Parfum,"Tuscan Leather Travel Atomizer, Tuscan Leather Eau de Parfum, Fucking Fabulous Travel Atomizer Eau de Parfum, Soleil Blanc Travel Atomizer, Fabulous Body Spray Scented Body Spray"
A Man's Cologne Eau de Parfum,"Vain & Naive Extrait de Parfum, 1885 Bains Sulfureux Eau de Parfum, 21 Eau de Parfum, French Bouquet Eau de Parfum, Black Beard Extrait de Parfum"
Villa Nellcote Eau de Parfum,"Rhodanthe Eau de Parfum, Panthea Eau de Parfum, Kolonya Eau de Toilette, New York Eau de Parfum, Coup de Foudre Eau de Parfum"
Portrayal Man Eau de Parfum,"Chameleon Eau de Parfum, Chypre Mousse Eau de Parfum, Violette Fumee, Interlude Black Iris Eau de Parfum, Basilico & Fellini Eau de Parfum"
Portrayal Woman,"Tubereuse Imperiale Eau de Parfum, Transilvania Extrait de Parfum, Hili Eau de Parfum, Wish Come True Eau de Parfum, Queen Of The Night Eau de Parfum"
Humus Eau de Parfum,"Chypre Mousse Eau de Parfum, Sloth Extrait de Parfum, Aran Parfum, Re-Charge Black Pepper Deodorant Stick, Danger Parfum Cologne"
Musc des Sables Eau de Parfum,"Chypre Azural Eau de Parfum, Gold Extrait de Parfum, Ani Extrait de Parfum, Nawab of Oudh - Intensivo, Ambre Cashmere Intense Eau de Parfum"
Iris Perle Eau de Parfum,"Fougere Emeraude Eau de Parfum, Jasmin de Cherifa Eau de Parfum, Chypre Azural Eau de Parfum, Fucking Fabulous Travel Atomizer Eau de Parfum, Cuir de Chine Eau de Parfum"
Rose de Jamal Eau de Parfum,"Kolonya Eau de Toilette, Elysium Pour Homme Extrait de Parfum, Le Maroc pour elle Eau de Parfum, Exit the King Eau de Parfum, Smoke Show Eau de Parfum"
Pineapple Essenza Eau de Parfum,"New York Eau de Parfum, L'Aimee Eau de Parfum, Danger Parfum Cologne, Cedrat Boise Eau de Parfum, X for Women Eau de Parfum"
Brandied Pear Eau de Parfum,"Jardin Exclusif Eau de Parfum, La Tosca Eau de Parfum, Iris Bleu Gris Eau de Parfum, Rhodanthe Eau de Parfum, Red Tobacco Eau de Parfum"
Nefs Extrait de Parfum,"Halfeti Eau de Parfum, Mysterious Oud Extrait de Parfum, Ashoka Eau de Parfum, Tyrannosaurus Rex Extrait de Parfum, Black Gold Eau de Parfum"
Megamare Parfum,"Hongkong Oolong Eau de Parfum, Dolls Eau de Parfum, Shihan Eau de Parfum, Fusion Sacree - Obscur Eau de Parfum, Patchouli Precieux Eau de Parfum"
Mahabah Eau de Parfum,"Coup de Foudre Eau de Parfum, Fleur de Lalita Eau de Parfum, Musk Aoud Extrait de Parfum, Tempted Muse Eau de Parfum, Lyric for Women Eau de Parfum"
Shaghaf Eau de Parfum,"Mysterious Oud Extrait de Parfum, Mohur Extrait Parfum Extrait, Trayee Eau de Parfum, Halfeti Eau de Parfum, Sartorial Eau de Toilette"
