Perfume,Similar Perfumes
Tihota Eau de Parfum,"L'Homme Aux Gants Eau de Parfum, Cuir Cavalier Eau de Parfum, Ambra Extrait de Parfum, Istanbul Eau de Parfum, Sheiduna Parfum Extrait"
Sola Parfum,"Sloth Extrait de Parfum, Eau My Soul Eau de Parfum, Endymion Cologne, Nocturnal Poetry Parfum, New York Eau de Parfum"
Kagiroi Parfum,"New York Eau de Parfum, Against Nature Eau de Parfum, Oliver Eau de Parfum, Mandarava Extrait de Parfum, Kolonya Eau de Toilette"
Velvet Fantasy Eau de Parfum,"20 Mars 2022 Eau de Parfum, Artemisia Eau de Parfum, L'Aimee Eau de Parfum, Coup de Foudre Eau de Parfum, Elixir Pour Femme Extrait de Parfum"
A Blvd. Called Sunset Eau de Parfum,"Mohur Extrait Parfum Extrait, Halfeti Eau de Parfum, Mohur Eau de Parfum, Vixere Eau de Parfum, Musk Aoud Extrait de Parfum"
Freckled and Beautiful Eau de Parfum,"Talc Gourmand Eau de Parfum, Vixere Eau de Parfum, L'Aimee Eau de Parfum, Bee Extrait de Parfum, Majaina Sin Eau de Parfum"
Exit the King Eau de Parfum,"20 Mars 2022 Eau de Parfum, Swan Princess Eau de Parfum, 1872 for Women Eau de Parfum, Velvet Fantasy Eau de Parfum, Coup de Foudre Eau de Parfum"
Eshu Extrait,"Homa Parfum, Haxan Eau de Parfum, Magenta Pop Eau de Parfum, Gheorghe Eau de Parfum, Mandodari Parfum"
Saringkarn Extrait,"Burning Ben Eau de Parfum, Nocturnal Poetry Parfum, Young Hearts Eau de Parfum, Coup de Foudre Eau de Parfum, Aran Parfum"
Arsalan Parfum,"Homa Parfum, Mandarava Extrait de Parfum, Trayee Eau de Parfum, Thichila Eau de Parfum, Halfeti Eau de Parfum"
Nocturnal Poetry Parfum,"Homa Parfum, 20 Mars 2022 Eau de Parfum, Mandarava Extrait de Parfum, Al Oudh Eau de Parfum, Saringkarn Extrait"
Homa Parfum,"Haxan Eau de Parfum, Thichila Eau de Parfum, Nocturnal Poetry Parfum, Mandarava Extrait de Parfum, Arsalan Parfum"
Koala Extrait de Parfum,"Laudano Nero Extrait de Parfum, Kolonya Eau de Toilette, Oud Stars - Ceylon Eau de Parfum, Eau My Soul Eau de Parfum, Velvet Fantasy Eau de Parfum"
L'Homme A La Rose Eau de Parfum,"Golden Moka Eau de Parfum, MEM Eau de Parfum, Chronic Eau de Parfum, Parisian Oud Eau de Parfum, Layton EXCLUSIF Eau de Parfum"
Rozu Eau de Parfum,"Celestial Eau de Parfum, Oud Abramad Eau de Parfum, Coup de Foudre Eau de Parfum, Keman Parfum, New York Intense Eau de Parfum"
Champs Lunaires Eau de Toilette,"Sable & Soleil Eau de Parfum, Versilia Aurum Eau de Parfum, Love Toxin Extrait de Parfum, Hili Eau de Parfum, MEM Eau de Parfum"
Prends-Moi Eau de Parfum,"Empressa Eau de Toilette, Tokyo Eau de Parfum, Mysterious Oud Extrait de Parfum, Layton EXCLUSIF Eau de Parfum, Tart's Knicker Drawer Eau de Parfum"
Eau de Cuisine Eau de Parfum,"Tigerlust Pure Parfum, Relique d'Amour Eau de Parfum, No. 4 Apres l'Amour Eau de Parfum, Percival Eau de Parfum, Close Up Eau de Parfum"
Disobbedienza Eau de Parfum,"Thurible Eau de Parfum, Laudano Nero Extrait de Parfum, Eshu Extrait, Homa Parfum, Celestial Eau de Parfum"
Vanille de Tahiti Eau de Parfum,"MEM Eau de Parfum, Champaca Absolute Eau de Parfum, Aurore Nomade Eau de Parfum, Enchanted Forest Eau de Parfum, Velvet Fantasy Eau de Parfum"
Gris Charnel Eau de Parfum,"Coup de Foudre Eau de Parfum, Oud Wood Travel Atomizer, Oud Wood Body Spray Scented Body Spray, Oud Wood Eau de Parfum, Figaro Eau de Toilette"
Milk Musk Eau de Toilette,"Rouge Smoking Eau de Parfum, Messy Sexy Just Rolled Out of Bed Eau de Parfum, Flower of Immortality Eau de Parfum, 20 Mars 2022 Eau de Parfum, Danger Parfum Cologne"
Blackberry Woods Eau de Parfum,"O/E Eau de Parfum, Terralba Eau de Parfum, Acqua Decima Eau de Toilette, Grand Neroli Cologne Absolue, Escale En Indonesie Eau De Cologne"
Lavande Romaine Eau de Parfum,"Fusion Sacree - Obscur Eau de Parfum, Sartorial Eau de Toilette, Forest Eau de Parfum, New York Eau de Parfum, Opale Eau de Parfum"
Celestial Eau de Parfum,"Rhodanthe Eau de Parfum, Puritas Eau de Parfum, L'Aimee Eau de Parfum, Coup de Foudre Eau de Parfum, Oud Luban Attar / perfume oil"
Puritas Eau de Parfum,"Mon Nom Est Rouge Eau de Parfum, New York Eau de Parfum, Mohur Extrait Parfum Extrait, Hyrax Extrait de Parfum, Parisian Oud Eau de Parfum"
Thurible Eau de Parfum,"Haxan Eau de Parfum, Ma Nishtana Extrait de Parfum, Chimaera Extrait de Parfum, Tendre est la Nuit Eau de Parfum, 20 Mars 2022 Eau de Parfum"
Suede Eau de Parfum,"SM Cafe Eau de Parfum, Derviche Eau de Toilette, Chimaera Extrait de Parfum, Nuit de Bakelite Eau de Parfum, Montabaco - Parfum"
Amber Eau de Parfum,"Jupiter Eau de Parfum, Wode Eau de Parfum, 21 Eau de Parfum, Saringkarn Extrait, Mon Nom Est Rouge Eau de Parfum"
Interlude Black Iris Eau de Parfum,"Interlude Man Eau de Parfum, Taklamakan Eau de Parfum, Eau My Soul Eau de Parfum, Black Prestigium Eau de Parfum, Halfeti Eau de Parfum"
Escale En Haiti Eau De Cologne,"Sultan Vetiver Extrait de Parfum, New York Eau de Parfum, 20 Mars 2022 Eau de Parfum, Oud Wood Travel Atomizer, Oud Wood Body Spray Scented Body Spray"
Escale En Indonesie Eau De Cologne,"Ambre Stone Eau de Parfum, O/E Eau de Parfum, Eau De Parfum Eau de Parfum, Vetiver Nocturne Autumn 19 Extrait de Parfum, Amber Cologne Eau de Parfum"
Zeste de Gingembre Eau de Parfum,"Mon Nom Est Rouge Eau de Parfum, Soleil d'Italie Eau de Parfum, Homa Parfum, Single Man Eau de Parfum, Coup de Foudre Eau de Parfum"
Haute Provence Eau de Parfum,"Le Vainqueur Eau de Parfum, Dryad Eau de Parfum, Zeybek Extrait de Parfum, Ambre Topkapi Eau de Parfum, Sola Parfum"
Escentric 05 - Travel Spray Eau de Toilette,"Escentric 05 Eau de Toilette, Escentric 04 - Travel Spray Eau de Toilette, Geza Schoen Eau de Toilette, Montabaco - Parfum, Montabaco - Intensivo"
1979 New Wave Eau de Parfum,"La Belle Helene Eau de Parfum, Taklamakan Eau de Parfum, Beachwood Eau de Parfum, Ramune (Japanese Soda) Eau de Parfum, Iris Silver Mist Eau de Parfum"
2018 Roxo Tonic Eau de Parfum,"Colognise Extrait de Cologne, Oolang Infini Cologne Absolue, Nio Eau de Parfum, Iridescent Sky Eau de Parfum, Le Barbier de Tanger Eau de Parfum"
Sel d'Argent Eau de Parfum,"Kolonya Eau de Toilette, Rouge Smoking Eau de Parfum, Capri Eau de Parfum, Gin Fizz Eau de Toilette, La Belle Helene Eau de Parfum"
Citrus Riviera Eau de Parfum,"French Bouquet Eau de Parfum, Pichola Eau de Parfum, Moon Fever, Vixere Eau de Parfum, L'Aimee Eau de Parfum"
Smoke Show Eau de Parfum,"20 Mars 2022 Eau de Parfum, Elysium Pour Homme Extrait de Parfum, Oliver Eau de Parfum, Ma Nishtana Extrait de Parfum, Elysium Parfum Cologne"
Do Not Disturb Eau de Parfum,"Panthea Eau de Parfum, Crystal Pistil Eau de Parfum, Vetiver Patchouli Eau de Parfum, New York Eau de Parfum, Mohur Extrait Parfum Extrait"
Room Service Eau de Parfum,"Velvet Fantasy Eau de Parfum, Ambre Cashmere Intense Eau de Parfum, Empressa Eau de Toilette, Rhodanthe Eau de Parfum, Vixere Eau de Parfum"
Purple Fig Eau de Parfum,"Capri Eau de Parfum, Haxan Eau de Parfum, Kolonya Eau de Toilette, Noorolain Taif Eau de Parfum, Jasmin Angelique Cologne Absolue"
Basilico & Fellini Eau de Parfum,"Chypre Mousse Eau de Parfum, Purple Fig Eau de Parfum, Poets of Berlin Eau de Parfum, Jardin du Poete Eau de Toilette, Bat Extrait de Parfum"
Poets of Berlin Eau de Parfum,"Santal Eau de Toilette, New York Eau de Parfum, Against Nature Eau de Parfum, L'Aimee Eau de Parfum, Coup de Foudre Eau de Parfum"
Morning Chess Eau de Parfum,"Oud Dream Eau de Parfum, 1900 L'Heure de Proust Eau de Parfum, The Orchid Man Eau de Parfum, Interlude Black Iris Eau de Parfum, Young Hearts Eau de Parfum"
Mango Skin Eau de Parfum,"New York Eau de Parfum, Mohur Eau de Parfum, 20 Mars 2022 Eau de Parfum, Coup de Foudre Eau de Parfum, Chameleon Eau de Parfum"
Dear Polly Eau de Parfum,"Koala Extrait de Parfum, The Time Eau de Parfum, Rhodanthe Eau de Parfum, Villa Nellcote Eau de Parfum, Kolonya Eau de Toilette"
Black Citrus Eau de Parfum,"Interlude Black Iris Eau de Parfum, Nio Eau de Parfum, Eau De Parfum Eau de Parfum, Scandal Parfum Cologne, Sensual Instinct Eau de Parfum"
Lil Fleur Eau de Parfum,"Silver Ombre Eau de Parfum, Velvet Amber, La Capitale Parfum, Instant Crush Eau de Parfum, Nefs Extrait de Parfum"
Kurokami Parfum,"MEM Eau de Parfum, Kolonya Eau de Toilette, Pink Wood Eau de Parfum, Tempted Muse Eau de Parfum, Interlude Woman"
Bouquet de Hongrie Eau de Parfum,"Wood Jasmin Eau de Parfum, Goddess of Love & Perfume Parfum Extrait, L'Aimee Eau de Parfum, Jardin Exclusif Eau de Parfum, Champ de Fleurs Eau de Cologne"
Undergrowth Eau de Parfum,"New York Eau de Parfum, Soleil d'Italie Eau de Parfum, Forest Eau de Parfum, Against Nature Eau de Parfum, Kira Kira Eau de Parfum"
Rook Eau de Parfum,"Oud Abramad Eau de Parfum, United Arab Emirates Aoud Extrait de Parfum, Red Hoba Eau de Parfum, Mortal Skin Eau de Parfum, Oud Maximus Autumn 19 Extrait de Parfum"
Forest Eau de Parfum,"Purple Haze Eau de Parfum, Relique d'Amour Eau de Parfum, Haxan Eau de Parfum, Divine Vanille Eau de Parfum, Mousse Illuminee Eau de Toilette"
Hapyang Eau de Parfum,"Tubereuse Imperiale Eau de Parfum, I Love YY, MEM Eau de Parfum, Pichola Eau de Parfum, Love Exposure Eau de Parfum"
Young Hearts Eau de Parfum,"Instant Crush Eau de Parfum, Amber Aoud Extrait de Parfum, Enchanted Forest Eau de Parfum, Saringkarn Extrait, Oud Noir Intense Eau de Parfum"
Eau de Yuzu Eau de Toilette,"Tom Yum Eau de Parfum, Villa Nellcote Eau de Parfum, Be Careful What You Wish For Parfum Extrait, Tsuki Eau de Parfum, 1976 Eau de Parfum"
Creme de Cuir Eau de Parfum,"Gold Incense Eau de Parfum, Rouge Smoking Eau de Parfum, New York Eau de Parfum, Vixere Eau de Parfum, Instant Crush Eau de Parfum"
Tabac Rose Eau de Parfum,"French Bouquet Eau de Parfum, Wood Jasmin Eau de Parfum, Coup de Foudre Eau de Parfum, Exit the King Eau de Parfum, Mon Nom Est Rouge Eau de Parfum"
French Bouquet Eau de Parfum,"Citrus Riviera Eau de Parfum, Pichola Eau de Parfum, Vixere Eau de Parfum, Coup de Foudre Eau de Parfum, Scandal Parfum Cologne"
Oud Abramad Eau de Parfum,"Rook Eau de Parfum, United Arab Emirates Aoud Extrait de Parfum, Wood Jasmin Eau de Parfum, Mon Nom Est Rouge Eau de Parfum, Oud Sublime Elixir de Parfum"
Rouge Smoking Eau de Parfum,"Coup de Foudre Eau de Parfum, Sel d'Argent Eau de Parfum, 20 Mars 2022 Eau de Parfum, Vixere Eau de Parfum, Oud Maximus Autumn 19 Extrait de Parfum"
Tubereuse Imperiale Eau de Parfum,"Wood Jasmin Eau de Parfum, Ashoka Eau de Parfum, Coup de Foudre Eau de Parfum, Mandarava Extrait de Parfum, Chameleon Eau de Parfum"
Nuit de Sable Eau de Parfum,"Scandal Parfum Cologne, Mon Nom Est Rouge Eau de Parfum, Halfeti Eau de Parfum, Wode Eau de Parfum, Exit the King Eau de Parfum"
Wood Jasmin Eau de Parfum,"Tubereuse Imperiale Eau de Parfum, Tabac Rose Eau de Parfum, French Bouquet Eau de Parfum, 20 Mars 2022 Eau de Parfum, Black Amber"
Pas Ce Soir Eau de Parfum,"Royal Sapphire Extrait de Parfum, Azzurro di Capri Extrait Parfum Extrait, Sartorial Eau de Toilette, Citrus Riviera Eau de Parfum, Patchouli Nobile Eau de Parfum"
Dolceacqua Eau de Parfum,"Sensual Instinct Eau de Parfum, Chameleon Eau de Parfum, La Belle Helene Eau de Parfum, Vepres Siciliennes Eau de Parfum, MEM Eau de Parfum"
Black Beard Extrait de Parfum,"Scandal Parfum Cologne, Knize Ten Eau de Toilette, Fougere Royale Eau de Parfum, Knize Ten Golden Edition Eau de Toilette, New York Eau de Parfum"
Transilvania Extrait de Parfum,"20 Mars 2022 Eau de Parfum, New York Intense Eau de Parfum, Moth Extrait de Parfum, Diaghilev Extrait de Parfum, Love Toxin Extrait de Parfum"
Love Toxin Extrait de Parfum,"Diaghilev Extrait de Parfum, Goddess of Love & Perfume Parfum Extrait, Vepres Siciliennes Eau de Parfum, Salome Eau de Parfum, Divine Eau de Parfum"
Oshun Extrait de Parfum,"Coup de Foudre Eau de Parfum, Mysterious Oud Extrait de Parfum, 20 Mars 2022 Eau de Parfum, New York Eau de Parfum, O/E Eau de Parfum"
Isra & Miraj Eau de Parfum,"Halfeti Eau de Parfum, Black Gold Eau de Parfum, Red Tobacco Eau de Parfum, Trayee Eau de Parfum, Nefs Extrait de Parfum"
Petits Papiers Eau de Parfum,"Taklamakan Eau de Parfum, On The Road Eau de Parfum, Haxan Eau de Parfum, Gheorghe Eau de Parfum, Sangre Dulce Eau de Parfum"
La Danza delle Libellule Eau de Parfum,"La Danza delle Libellule Exceptional Edition Parfum Extrait, Knize Ten Eau de Toilette, Hili Eau de Parfum, White Madera Eau de Parfum, Fusion Sacree - Obscur Eau de Parfum"
Magnolia Grandiflora - Michel Eau de Parfum,"Villa Nellcote Eau de Parfum, Shaft of Light Eau de Parfum, Diaghilev Extrait de Parfum, New York Eau de Parfum, Kolonya Eau de Toilette"
Bell'Antonio Eau de Parfum,"Maxed Out Parfum Extrait, Shihan Eau de Parfum, Cigar Rum Intense Extrait de Parfum, Nocturnal Poetry Parfum, Fusion Sacree - Obscur Eau de Parfum"
Golden Moka Eau de Parfum,"Golden Dallah Eau de Parfum, Blue Sapphire Eau de Parfum, Coup de Foudre Eau de Parfum, Cigar Rum Intense Extrait de Parfum, Forty Thieves Eau de Parfum"
Oud Stars - Indochine Parfum,"Black Sukar Attar / perfume oil, Rhodanthe Eau de Parfum, Oud Maximus Autumn 19 Extrait de Parfum, Love Eau de Parfum, 20 Mars 2022 Eau de Parfum"
Fatal Charme Eau de Parfum,"Keep Glazed Eau de Parfum, Scent Of Paradise Extrait de Parfum, Love Toxin Extrait de Parfum, Manteuse Eau de Parfum, Panthea Eau de Parfum"
Mad About You Eau de Parfum,"Magenta Pop Eau de Parfum, 1900 L'Heure de Proust Eau de Parfum, Black Eau de Toilette, Velvet Fantasy Eau de Parfum, Myrrhiad Eau de Parfum"
Anti-Blues,"Burning Ben Eau de Parfum, Saringkarn Extrait, Red Tobacco Eau de Parfum, Kiviskin Eau de Parfum, Chimaera Extrait de Parfum"
Tahiti Vanilla Parfum,"Kolonya Eau de Toilette, Diaghilev Extrait de Parfum, No. 1 for Men Eau de Parfum, Pichola Eau de Parfum, O/E Eau de Parfum"
Fuyu Eau de Parfum,"L'Aimee Eau de Parfum, Cuir Cavalier Eau de Parfum, Do Not Disturb Eau de Parfum, Sweet Flowers Eau de Parfum, Princesses de Malabar Eau de Parfum"
Perfumista Eau de Parfum,"Glorious Eau de Parfum, Elixir Pour Femme Extrait de Parfum, Vain & Naive Extrait de Parfum, Qatar Extrait de parfum, Bouquet de Hongrie Eau de Parfum"
Douleur! Eau de Parfum,"Mohur Extrait Parfum Extrait, Poudre de Riz Eau de Parfum, Petra Eau de Parfum, Ani Extrait de Parfum, Qatar Extrait de parfum"
Ambre Stone Eau de Parfum,"Vetiver Nocturne Autumn 19 Extrait de Parfum, Escale En Indonesie Eau De Cologne, Citrus Riviera Eau de Parfum, Pichola Eau de Parfum, Trayee Eau de Parfum"
Vanille d'Amine Eau de Parfum,"Oriental Velours Eau de Parfum, Trayee Eau de Parfum, Reve en Cuir Eau de Parfum, New York Intense Eau de Parfum, Mxxx. Extrait de Parfum"
Bergamote de G. Franco Eau de Parfum,"Ambre Stone Eau de Parfum, Cuir de Chine Eau de Parfum, Fougere Emeraude Eau de Parfum, Vetiver de Pierre Eau de Parfum, Pichola Eau de Parfum"
Vetiver de Pierre Eau de Parfum,"Fougere Emeraude Eau de Parfum, Bergamote de G. Franco Eau de Parfum, Fougere Nobile Eau de Parfum, Trayee Eau de Parfum, Chypre Azural Eau de Parfum"
Jasmin de Cherifa Eau de Parfum,"Chypre Azural Eau de Parfum, Iris Perle Eau de Parfum, Ambre Stone Eau de Parfum, Pichola Eau de Parfum, Trayee Eau de Parfum"
I Love YY,"Moss Cologne Eau de Parfum, Coup de Foudre Eau de Parfum, Elixir Pour Femme Extrait de Parfum, Halfeti Eau de Parfum, MEM Eau de Parfum"
New York Eau de Parfum,"Kolonya Eau de Toilette, Elysium Pour Homme Extrait de Parfum, L'Aimee Eau de Parfum, Oliver Eau de Parfum, Eau My Soul Eau de Parfum"
Gold II Sahara Parfum Extrait,"Camel Extrait de Parfum, Upper Ten Eau de Parfum, Bois d'Oud Eau de Parfum, Perdizione Eau de Parfum, Mon Nom Est Rouge Eau de Parfum"
Bengale Rouge Eau de Parfum,"Taklamakan Eau de Parfum, Mohur Eau de Parfum, Coup de Foudre Eau de Parfum, Mysterious Oud Extrait de Parfum, Eau My Soul Eau de Parfum"
Avatar Eau de Parfum,"Quilombo Eau de Parfum, Platino, Crema di Latte Eau de Parfum, What About Pop Eau de Parfum, Sticky Cake Eau de Toilette"
Midnight Saffron Eau de Parfum,"Instant Crush Eau de Parfum, No. 3 Crepuscule Ardent Eau de Parfum, Chameleon Eau de Parfum, Halfeti Eau de Parfum, Lil Fleur Eau de Parfum"
Dolls Eau de Parfum,"Or du Serail Eau de Parfum, Fusion Sacree - Obscur Eau de Parfum, Impressions de Giverny Eau de Parfum, Enchanted Forest Eau de Parfum, Knize Ten Eau de Toilette"
Opale Eau de Parfum,"New York Eau de Parfum, 20 Years Eau de Parfum, Mon Nom Est Rouge Eau de Parfum, L'Aimee Eau de Parfum, Sweet Flowers Eau de Parfum"
Poudrextase Eau de Parfum,"Maai Eau de Parfum, Poudre de Riz Eau de Parfum, Corpse Reviver Eau de Parfum, Yawahada (Soft Skin) Eau de Parfum, Camel Extrait de Parfum"
Single Man Eau de Parfum,"Mon Nom Est Rouge Eau de Parfum, Sartorial Eau de Toilette, Villa Nellcote Eau de Parfum, Purple Flowers Eau de Parfum, Glorious Eau de Parfum"
Whisky Oud Parfum Concentration,"Jupiter Eau de Parfum, Trayee Eau de Parfum, Camel Extrait de Parfum, Red Tobacco Eau de Parfum, Amber Room Eau de Parfum"
Limited 71 Intense Eau de Parfum,"Noble VII Rock Rose Extrait de Parfum, New York Eau de Parfum, Haxan Eau de Parfum, Milano Cento Deodorant Stick, Milano Cento For Him Eau de Toilette"
Lambrosc Eau de Parfum,"Mad About You Eau de Parfum, Magenta Pop Eau de Parfum, Comme Un Carrousel Eau de Parfum, Live In Colors Eau de Parfum, Istanbul Eau de Parfum"
Donna Sentenza Eau de Parfum,"Vanille Banane Eau de Toilette, Buonissimo Eau de Parfum, Platino, Vanilla Cake Eau de Parfum, Tuberose & Moss Eau de Toilette"
Manteuse Eau de Parfum,"Black IV Parfum Extrait, King Of Flowers Extrait de Parfum, Derviche Eau de Toilette, Aoud Exclusif Eau de Parfum, Leather Patchouli Eau de Parfum"
Against Nature Eau de Parfum,"New York Eau de Parfum, Chameleon Eau de Parfum, Kolonya Eau de Toilette, 1976 Eau de Parfum, Peacock Throne Eau de Parfum"
Cornaline Eau de Parfum,"Elixir Pour Femme Extrait de Parfum, Trimerous Eau de Parfum, Aventus For Her Eau de Parfum, Qatar Extrait de parfum, Or du Serail Eau de Parfum"
Bluebijou Eau de Parfum,"Saringkarn Extrait, Burning Ben Eau de Parfum, Nocturnal Poetry Parfum, Anti-Blues, Kiviskin Eau de Parfum"
Kiviskin Eau de Parfum,"Saringkarn Extrait, Anti-Blues, Burning Ben Eau de Parfum, Nefs Extrait de Parfum, Ummagumma Eau de Parfum"
Venom of Angel Eau de Parfum,"Eshu Extrait, Celestial Eau de Parfum, Forest Eau de Parfum, Villa Nellcote Eau de Parfum, Purple Flowers Eau de Parfum"
Hili Eau de Parfum,"Chameleon Eau de Parfum, New York Eau de Parfum, Coup de Foudre Eau de Parfum, Sweet Flowers Eau de Parfum, Kolonya Eau de Toilette"
Niral Eau de Parfum,"Rahele Eau de Parfum, Mohur Extrait Parfum Extrait, Mohur Eau de Parfum, Oliver Eau de Parfum, Villa Nellcote Eau de Parfum"
London Eau de Parfum,"Velvet Fantasy Eau de Parfum, Oud Stars - Alexandria III Parfum, Danger Parfum Cologne, Elixir Pour Femme Extrait de Parfum, Oud Stars - Malesia Eau de Parfum"
Buonissimo Eau de Parfum,"Donna Sentenza Eau de Parfum, Platino, Vanilla Cake Eau de Parfum, Tuberose & Moss Eau de Toilette, Majaina Sin Eau de Parfum"
Boronia Eau de Parfum,"Montabaco - Parfum, Montabaco - Intensivo, Ryder Eau de Parfum, Eshu Extrait, Forest Eau de Parfum"
Ambilux (formerly 50ml d'Ambiguite) Eau de Parfum,"Tubereuse Imperiale Eau de Parfum, Al Oudh Eau de Parfum, Homa Parfum, Oud Abramad Eau de Parfum, Love Exposure Eau de Parfum"
Grimoire Eau de Parfum,"21 Eau de Parfum, Eshu Extrait, Black Beard Extrait de Parfum, Fougere Nobile Eau de Parfum, Trayee Eau de Parfum"
The Decay Of The Angel Eau de Parfum,"20 Mars 2022 Eau de Parfum, Mandarava Extrait de Parfum, Tyrannosaurus Rex Extrait de Parfum, MEM Eau de Parfum, Jubilation XXV Eau de Parfum"
Dryad Eau de Parfum,"Diaghilev Extrait de Parfum, Haxan Eau de Parfum, Oliver Eau de Parfum, Kolonya Eau de Toilette, L'Aimee Eau de Parfum"
L'homme Accompli Eau de Parfum,"Elysium Parfum Cologne, Danger Parfum Cologne, Vetiver Parfum Cologne, Mefisto Gentiluomo Eau de Parfum, Diaghilev Extrait de Parfum"
White Madera Eau de Parfum,"Madera Eau de Parfum, Arabesque Attar / Perfume Oil, Golden Powder Eau de Parfum, Upper Ten Eau de Parfum, La Danza delle Libellule Eau de Parfum"
Cactus Azul Eau de Parfum,"Dolceacqua Eau de Parfum, Onice Eau de Parfum ..., Pomelo Riviera Eau de Parfum, Rose de Jamal Eau de Parfum, No. 1 Tonic Blanc Eau de Parfum"
Chamber Eau de Parfum,"Qi - Intensivo, Soft Tension Eau de Parfum, Cedrat Boise Eau de Parfum, FRANK No. 1 Eau de Parfum, Exit the King Eau de Parfum"
Jacaranda Eau de Parfum,"Kagiroi Parfum, Nocturnal Poetry Parfum, Kurokami Parfum, Single Man Eau de Parfum, MEM Eau de Parfum"
Muskara Phero J Eau de Parfum,"Patchouli Absolu Eau de Parfum, Tabac Rose Eau de Parfum, Chypre Azural Eau de Parfum, Lost Cherry Eau de Parfum, L'Aimee Eau de Parfum"
Quilombo Eau de Parfum,"Crema di Latte Eau de Parfum, Sugarwood Eau de Parfum, Sucre Noir Parfum, Freckled and Beautiful Eau de Parfum, Mango Skin Eau de Parfum"
Thays Eau de Parfum,"Qi - Intensivo, Menthe Fraiche Eau de Parfum, Niral Eau de Parfum, Boronia Eau de Parfum, Rahele Eau de Parfum"
La Cautiva Eau de Parfum,"Black IV Parfum Extrait, Goddess of Love & Perfume Parfum Extrait, Nero Eau de Parfum, L'Infante Eau de Parfum, Pineapple Essenza Eau de Parfum"
Biblioteca de Babel Eau de Parfum,"Mon Nom Est Rouge Eau de Parfum, SpeM PetraM Eau de Parfum, Labyrinth Of Spices Extrait de Parfum, Eshu Extrait, La Danza delle Libellule Eau de Parfum"
Panthea Eau de Parfum,"Villa Nellcote Eau de Parfum, New York Eau de Parfum, Fougere Nobile Eau de Parfum, Mohur Extrait Parfum Extrait, Gold Incense Eau de Parfum"
Wish Come True Eau de Parfum,"Diaghilev Extrait de Parfum, MEM Eau de Parfum, Coup de Foudre Eau de Parfum, Moss Cologne Eau de Parfum, 1885 Bains Sulfureux Eau de Parfum"
MEM Eau de Parfum,"20 Mars 2022 Eau de Parfum, L'Aimee Eau de Parfum, Coup de Foudre Eau de Parfum, Kolonya Eau de Toilette, Elysium Pour Homme Extrait de Parfum"
Delma Eau de Parfum,"Percival Eau de Parfum, Diaghilev Extrait de Parfum, Halfeti Eau de Parfum, Petra Eau de Parfum, L'Aimee Eau de Parfum"
Liwa Eau de Parfum,"Upper Ten Eau de Parfum, L'Aimee Eau de Parfum, Instant Crush Eau de Parfum, Halfeti Eau de Parfum, New York Eau de Parfum"
Aqaysos Eau de Parfum,"Hedonist Iris Absolute Eau de Parfum, Liaisons Dangereuses Eau de Parfum, Kagiroi Parfum, Maxed Out Parfum Extrait, Royal Muska Eau de Parfum"
Il Tempo delle Mele Eau de Parfum,"Freckled and Beautiful Eau de Parfum, La Danza delle Libellule Eau de Parfum, Hili Eau de Parfum, Quilombo Eau de Parfum, Gold I Parfum Extrait"
Hot Milk Eau de Parfum,"Hili Eau de Parfum, Mohur Eau de Parfum, If by RK Eau de Parfum, Tubereuse - Les Nombres d'Or Eau de Parfum, 21 Eau de Parfum"
Carnicure (formerly L'animal sauvage) Eau de Parfum,"Diaghilev Extrait de Parfum, 20 Mars 2022 Eau de Parfum, Vixere Eau de Parfum, 1885 Bains Sulfureux Eau de Parfum, Qatar Extrait de parfum"
Passion Eau de Parfum,"Amber Intense Eau de Parfum, Suleyman le Magnifique Eau de Parfum, Arsalan Parfum, Fusion Sacree - Obscur Eau de Parfum, Jubilation XXV Eau de Parfum"
Rahele Eau de Parfum,"Halfeti Eau de Parfum, Niral Eau de Parfum, Mohur Extrait Parfum Extrait, Oliver Eau de Parfum, Tyrannosaurus Rex Extrait de Parfum"
Sweet Parmesan Violet Eau de Parfum,"Vanille Exclusive Eau de Parfum, Velvet Fantasy Eau de Parfum, A Blvd. Called Sunset Eau de Parfum, Nocturnal Poetry Parfum, Interlude Black Iris Eau de Parfum"
Una Tira l'Altra Eau de Parfum,"Rouge Smoking Eau de Parfum, Transilvania Extrait de Parfum, Dolls Eau de Parfum, Cafe Chantant Parfum Extrait, Lost Cherry Eau de Parfum"
Oud Orange Intense Eau de Parfum,"Camel Extrait de Parfum, Transilvania Extrait de Parfum, Love Toxin Extrait de Parfum, Isra & Miraj Eau de Parfum, La Danza delle Libellule Eau de Parfum"
Oud Noir Intense Eau de Parfum,"Halfeti Eau de Parfum, Sahraa Oud Eau de Parfum, Mohur Extrait Parfum Extrait, Velvet Amber, Instant Crush Eau de Parfum"
Sahraa Oud Eau de Parfum,"Oud Noir Intense Eau de Parfum, Trayee Eau de Parfum, Parisian Oud Eau de Parfum, Halfeti Eau de Parfum, Epic Woman Eau de Parfum"
London Oud Eau de Parfum,"Halfeti Eau de Parfum, Oud Noir Intense Eau de Parfum, Black Gold Eau de Parfum, Fiero Eau de Parfum, Regio Eau de Parfum"
Oud Jaune Intense Eau de Parfum,"Queen Of The Night Eau de Parfum, Vixere Eau de Parfum, Almond Harmony Eau de Parfum, Camel Extrait de Parfum, Bois d'Oud Eau de Parfum"
Oud Bleu Intense Eau de Parfum,"Ma Nishtana Extrait de Parfum, Mandarava Extrait de Parfum, Mysterious Oud Extrait de Parfum, Parisian Oud Eau de Parfum, Akkad Eau de Parfum"
Oud Rouge Intense Eau de Parfum,"Mon Nom Est Rouge Eau de Parfum, Rhodanthe Eau de Parfum, Amber Room Eau de Parfum, Al Oudh Eau de Parfum, Against Nature Eau de Parfum"
Verde di Persia Parfum Concentration,"Enchanted Forest Eau de Parfum, Silver Ombre Eau de Parfum, Villa Nellcote Eau de Parfum, Hisui (Jade) Eau de Parfum, Shaft of Light Eau de Parfum"
20 Years Eau de Parfum,"New York Eau de Parfum, Fusion Sacree - Obscur Eau de Parfum, L'Aimee Eau de Parfum, Shaft of Light Eau de Parfum, Kolonya Eau de Toilette"
Gold I Parfum Extrait,"Aoud Exclusif Eau de Parfum, Red Tobacco Eau de Parfum, Arabesque Attar / Perfume Oil, Jardin Exclusif Eau de Parfum, Sweet Flowers Eau de Parfum"
Queen Of The Night Eau de Parfum,"Vixere Eau de Parfum, Oud Jaune Intense Eau de Parfum, Tubereuse Criminelle Eau de Parfum, Diaghilev Extrait de Parfum, Pichola Eau de Parfum"
Cafe Chantant Parfum Extrait,"Rouge Smoking Eau de Parfum, Transilvania Extrait de Parfum, Taklamakan Eau de Parfum, Vixere Eau de Parfum, Gheorghe Eau de Parfum"
Taklamakan Eau de Parfum,"Mysterious Oud Extrait de Parfum, Ambre Cashmere Intense Eau de Parfum, L'Aimee Eau de Parfum, Coup de Foudre Eau de Parfum, 1885 Bains Sulfureux Eau de Parfum"
"Eye, Hatshepsut Eau de Parfum","Red Hoba Eau de Parfum, Mon Nom Est Rouge Eau de Parfum, Trayee Eau de Parfum, Ambre Cashmere Intense Eau de Parfum, Taklamakan Eau de Parfum"
Perdizione Eau de Parfum,"Kolonya Eau de Toilette, No. 89 Eau de Toilette, Knize Ten Eau de Toilette, MEM Eau de Parfum, Fusion Sacree - Obscur Eau de Parfum"
