Perfume,Similar Perfumes
Reve d'Ossian Eau de Parfum,"Coup de Foudre Eau de Parfum, Mysterious Oud Extrait de Parfum, Tango Eau de Parfum, Resina Eau de Parfum, Taklamakan Eau de Parfum"
Chypre Mousse Eau de Parfum,"Fumabat Eau de Parfum, Russian Leather Eau de Parfum, Muguet Fleuri Eau de Parfum, Haxan Eau de Parfum, Oliver Eau de Parfum"
Horizon Eau de Parfum,"Eau My Soul Eau de Parfum, Oliver Eau de Parfum, Laudano Nero Extrait de Parfum, Interlude Woman, Salome Eau de Parfum"
Roses Vanille Eau de Parfum,"New York Eau de Parfum, Silver Ombre Eau de Parfum, Mon Nom Est Rouge Eau de Parfum, Rhodanthe Eau de Parfum, Arabesque Attar / Perfume Oil"
Sunshine and Pancakes Eau de Parfum,"Qatar Extrait de parfum, Transilvania Extrait de Parfum, MEM Eau de Parfum, 20 Years Eau de Parfum, Queen Of The Night Eau de Parfum"
The Sexiest Scent on the Planet. Ever. (IMHO) Eau de Parfum,"New York Eau de Parfum, Wish Come True Eau de Parfum, Fusion Sacree - Obscur Eau de Parfum, Purple Haze Eau de Parfum, Trimerous Eau de Parfum"
The Dark Heart of Old Havana Eau de Parfum,"Nocturnal Poetry Parfum, Bell'Antonio Eau de Parfum, Maxed Out Parfum Extrait, Shihan Eau de Parfum, 1969 Travel Spray Eau de Parfum"
South Bay Eau de Toilette,"Anti-Blues, Mr. Vetiver Eau de Parfum, Isle of Man Eau de Parfum, Chronic Eau de Parfum, Escentric 04 - Travel Spray Eau de Toilette"
Diamond Perfume Oil,"Kolonya Eau de Toilette, Velvet Fantasy Eau de Parfum, Koala Extrait de Parfum, Vanille de Tahiti Eau de Parfum, 1979 New Wave Eau de Parfum"
11 - Semma Eau de Parfum,"Mysterious Oud Extrait de Parfum, Gheorghe Eau de Parfum, Coup de Foudre Eau de Parfum, Io Non Ho Mani Che Mi Accarezzino il Volto Extrait de Parfum, Geisha Rouge - Eau de Parfum"
Isparta Eau de Parfum,"Amber Intense Eau de Parfum, United Arab Emirates Aoud Extrait de Parfum, Diaghilev Extrait de Parfum, Enchanted Forest Eau de Parfum, Oud Abramad Eau de Parfum"
Coven Eau de Parfum,"Terre Noire Eau de Parfum, Undergrowth Eau de Parfum, Mohur Extrait Parfum Extrait, Shihan Eau de Parfum, Salvia Sclarea Eau de Parfum"
Rose Oud Eau de Parfum,"Velvet Amber, Laudano Nero Extrait de Parfum, No. 1 for Women Eau de Parfum, New York Eau de Parfum, Oud Noir Intense Eau de Parfum"
Amber Oud Eau de Parfum,"Halfeti Eau de Parfum, 21 Eau de Parfum, Mon Nom Est Rouge Eau de Parfum, 20 Mars 2022 Eau de Parfum, Haxan Eau de Parfum"
Terralba Eau de Parfum,"O/E Eau de Parfum, Haxan Eau de Parfum, Oliver Eau de Parfum, Riviera Lazuli Eau de Parfum, Costa Azzurra Acqua Eau de Toilette"
Montecristo Eau de Parfum,"Tendre est la Nuit Eau de Parfum, Nio Eau de Parfum, Haxan Eau de Parfum, L'Aimee Eau de Parfum, Herod Eau de Parfum"
Luci Ed Ombre Eau de Parfum,"Trayee Eau de Parfum, Homa Parfum, Tubereuse Imperiale Eau de Parfum, Patchouli Nobile Eau de Parfum, Sweet Flowers Eau de Parfum"
Bal d'Afrique Eau de Parfum,"Bal D'Afrique Roll-on Oil Perfume Oil, Bal d'Afrique Hair Perfume, Danger Parfum Cologne, Scandal Parfum Cologne, Kolonya Eau de Toilette"
Pulp Eau de Parfum,"Orion Extrait de Parfum, Glorious Eau de Parfum, Dia Woman Eau de Parfum, La Danza delle Libellule Eau de Parfum, Single Man Eau de Parfum"
Gypsy Water Eau de Parfum,"Gypsy Water Hair Perfume, New York Eau de Parfum, O/E Eau de Parfum, Mon Nom Est Rouge Eau de Parfum, Coup de Foudre Eau de Parfum"
Rose Noir Eau de Parfum,"Kedu Eau de Parfum, MEM Eau de Parfum, Morning Muscs Eau de Parfum, Jardin du Poete Eau de Toilette, Villa Nellcote Eau de Parfum"
Blanche Eau de Parfum,"Blanche Hair Perfume, Kolonya Eau de Toilette, Gold Incense Eau de Parfum, Hummingbird Extrait de Parfum, Empressa Eau de Toilette"
Sunday Cologne Eau de Parfum,"Scandal Parfum Cologne, Le Barbier de Tanger Eau de Parfum, Sancti Eau de Parfum, Jade Eau de Parfum, Endymion Cologne"
Baudelaire Eau de Parfum,"Ma Nishtana Extrait de Parfum, Pachuli Kozha Extrait de Parfum, 1996 Eau de Parfum, Coal Eau de Parfum, Thurible Eau de Parfum"
La Tulipe Eau de Parfum,"La Tulipe Hair Perfume, Grace by Grace Coddington Eau de Toilette, Purple Fig Eau de Parfum, Vetiver de Pierre Eau de Parfum, Danger Parfum Cologne"
Accord Oud,"Woody Mood Eau de Parfum, Riviere Extrait de Parfum, Russian Leather Eau de Parfum, Wode Eau de Parfum, Haxan Eau de Parfum"
Oud Immortel Eau de Parfum,"L'Homme Sage Eau de Parfum, Christopher Street Eau de Parfum, Trayee Eau de Parfum, Eau De Parfum Eau de Parfum, 2015 Le Phenix Eau de Parfum"
Black Saffron Eau de Parfum,"Wode Eau de Parfum, Rhodanthe Eau de Parfum, Hossegor Eau de Parfum, Chameleon Eau de Parfum, 1996 Eau de Parfum"
Inflorescence Eau de Parfum,"Swan Princess Eau de Parfum, Exit the King Eau de Parfum, 20 Mars 2022 Eau de Parfum, Coup de Foudre Eau de Parfum, Elysium Pour Homme Extrait de Parfum"
1996 Eau de Parfum,"Mohur Eau de Parfum, Ambre Cashmere Intense Eau de Parfum, Sartorial Eau de Toilette, Velvet Fantasy Eau de Parfum, Interlude Black Iris Eau de Parfum"
Cedrat Enivrant Cologne Absolue,"Fougere Nobile Eau de Parfum, Scandal Parfum Cologne, Journey Man Eau de Parfum, Green Eau de Toilette, Fils de Dieu Eau de Parfum"
Nuit Andalouse Eau de Parfum,"Vixere Eau de Parfum, Jardin Exclusif Eau de Parfum, Diaghilev Extrait de Parfum, Halfeti Eau de Parfum, Patchouli Precieux Eau de Parfum"
Eight and Bob Eau de Parfum,"Qatar Extrait de parfum, Rahele Eau de Parfum, Poudre de Riz Eau de Parfum, Baikal Leather Intense Eau de Parfum, Splendiris Eau de Parfum"
Anyway Eau de Parfum,"Ambre Royal Eau de Parfum, Sel d'Argent Eau de Parfum, Citrus Riviera Eau de Parfum, Purple Fig Eau de Parfum, Tahiti Vanilla Parfum"
Cuir Garamante Eau de Parfum,"Forty Thieves Eau de Parfum, Al Oudh Eau de Parfum, Ma Nishtana Extrait de Parfum, Aoud Exclusif Eau de Parfum, Mysterious Oud Extrait de Parfum"
Black Eau de Toilette,"Oud Wood Travel Atomizer, Mx. Eau de Parfum, Oud Wood Body Spray Scented Body Spray, Oud Wood Eau de Parfum, Ashoka Eau de Parfum"
Thirty Three Eau de Parfum,"New York Eau de Parfum, Villa Nellcote Eau de Parfum, Purple Flowers Eau de Parfum, Mohur Eau de Parfum, Rhodanthe Eau de Parfum"
Ardent Eau de Parfum,"Enchanted Forest Eau de Parfum, Taklamakan Eau de Parfum, Mohur Eau de Parfum, Mohur Extrait Parfum Extrait, Mon Nom Est Rouge Eau de Parfum"
Sugi Eau de Toilette,"O/E Eau de Parfum, Amber Room Eau de Parfum, Tom of Finland Eau de Parfum, Forest Eau de Parfum, Nio Eau de Parfum"
Red Eau de Toilette,"Ashoka Eau de Parfum, Gold Extrait de Parfum, Mysterious Oud Extrait de Parfum, Itasca Eau de Parfum, Petra Eau de Parfum"
Green Eau de Toilette,"Korrigan Eau de Parfum, Cedrat Enivrant Cologne Absolue, Escentric 05 - Travel Spray Eau de Toilette, O/E Eau de Parfum, Trayee Eau de Parfum"
Laurel Eau de Toilette,"Mon Nom Est Rouge Eau de Parfum, Forest Eau de Parfum, Single Man Eau de Parfum, Hili Eau de Parfum, Liwa Eau de Parfum"
Hinoki Eau de Toilette,"O/E Eau de Parfum, Mississippi Medicine Pocket Perfume Perfume Oil, Bowmakers Pocket Perfume Perfume Oil, Bowmakers Eau de Parfum, Mississippi Medicine Eau de Parfum"
Oud Wood Eau de Parfum,"Oud Wood Travel Atomizer, Oud Wood Body Spray Scented Body Spray, Tobacco Oud Eau de Parfum, Tobacco Vanille Travel Atomizer, Tobacco Oud Intense Eau de Parfum"
Tobacco Oud Eau de Parfum,"Tobacco Oud Intense Eau de Parfum, Oud Wood Travel Atomizer, Oud Wood Body Spray Scented Body Spray, Oud Wood Eau de Parfum, Lost Cherry Eau de Parfum"
Fate Man Eau de Parfum,"20 Mars 2022 Eau de Parfum, Mon Nom Est Rouge Eau de Parfum, Scandal Parfum Cologne, Lyric for Women Eau de Parfum, 21 Eau de Parfum"
Fate Woman,"20 Mars 2022 Eau de Parfum, Coup de Foudre Eau de Parfum, Mysterious Oud Extrait de Parfum, Diaghilev Extrait de Parfum, Lyric for Women Eau de Parfum"
Nemer Eau de Parfum,"Oud Noir Intense Eau de Parfum, Sahraa Oud Eau de Parfum, Aurora Eau de Parfum, Aoud Exclusif Eau de Parfum, Hyrax Extrait de Parfum"
Zagorsk Eau de Toilette,"Chimaera Extrait de Parfum, FRANK No. 1 Eau de Parfum, Forest Eau de Parfum, Sandalo Nobile Eau de Parfum, Relique d'Amour Eau de Parfum"
Avignon Eau de Toilette,"Mohur Extrait Parfum Extrait, Mohur Eau de Parfum, Trayee Eau de Parfum, Jupiter Eau de Parfum, Tendre est la Nuit Eau de Parfum"
Kyoto Eau de Toilette,"Trayee Eau de Parfum, Sancti Eau de Parfum, Single Man Eau de Parfum, L'Homme Sage Eau de Parfum, Rudis Eau de Parfum"
Jaisalmer Eau de Toilette,"Myrrh Casati Eau de Parfum, Tango Eau de Parfum, Female Christ Eau de Parfum, Red Tobacco Eau de Parfum, Red Hoba Eau de Parfum"
Ouarzazate Eau de Toilette,"Haxan Eau de Parfum, 21 Eau de Parfum, Divine Vanille Eau de Parfum, Endymion Cologne, Mon Nom Est Rouge Eau de Parfum"
Perfect Coconut Milk Eau de Parfum,"Vixere Eau de Parfum, Almond Harmony Eau de Parfum, Datura Noir Eau de Parfum, Sable & Soleil Eau de Parfum, Heliotrope Eau de Parfum"
Lentisque Eau de Toilette,"Masculin Pluriel Eau de Toilette, Rudis Eau de Parfum, Trayee Eau de Parfum, Haxan Eau de Parfum, Elysium Parfum Cologne"
Tabac Rouge Eau de Parfum,"Une Nuit Magnetique Eau de Parfum, Shihan Eau de Parfum, Trayee Eau de Parfum, Hongkong Oolong Eau de Parfum, Ani Extrait de Parfum"
Rouge Avignon Eau de Parfum,"Elixir Pour Femme Extrait de Parfum, Kolonya Eau de Toilette, Tokyo Eau de Parfum, 10 Corso Como Eau de Parfum, Laudano Nero Extrait de Parfum"
Black Vetiver Eau de Parfum,"Re-Charge Black Pepper Deodorant Stick, Magnolia Grandiflora - Michel Eau de Parfum, New York Eau de Parfum, Against Nature Eau de Parfum, O/E Eau de Parfum"
Lapis Philosophorum Eau de Parfum,"Fusion Sacree - Obscur Eau de Parfum, Relique d'Amour Eau de Parfum, Jubilation XXV Eau de Parfum, Parisian Oud Eau de Parfum, Nightingale Extrait de Parfum"
Violette Fumee,"Oliver Eau de Parfum, Noble VII Rock Rose Extrait de Parfum, Dryad Eau de Parfum, Salvia Sclarea Eau de Parfum, Haxan Eau de Parfum"
Champaca Absolute Eau de Parfum,"Fleur de Portofino Eau de Parfum, Jasmin Rouge Eau de Parfum, Soleil Neige Eau de Parfum, Neroli Portofino Travel Atomizer, Neroli Portofino Eau de Parfum"
Jasmin Rouge Eau de Parfum,"Neroli Portofino Travel Atomizer, Sole di Positano Eau de Parfum, Champaca Absolute Eau de Parfum, Neroli Portofino Eau de Parfum, Soleil Neige Eau de Parfum"
Neroli Portofino Eau de Parfum,"Neroli Portofino Travel Atomizer, Sole di Positano Eau de Parfum, Fleur de Portofino Eau de Parfum, Soleil Neige Eau de Parfum, Fucking Fabulous Travel Atomizer Eau de Parfum"
Noir de Noir Eau de Parfum,"Noir de Noir Travel Atomizer, Oud Wood Travel Atomizer, Oud Wood Body Spray Scented Body Spray, Fleur de Portofino Eau de Parfum, Oud Wood Eau de Parfum"
Santal Blush Eau de Parfum,"Soleil Neige Eau de Parfum, Jasmin Rouge Eau de Parfum, Lavender Extreme Eau de Parfum, Neroli Portofino Travel Atomizer, Tobacco Oud Intense Eau de Parfum"
Tobacco Vanille Eau de Parfum,"Tobacco Vanille Travel Atomizer, Oud Wood Travel Atomizer, Oud Wood Body Spray Scented Body Spray, Oud Wood Eau de Parfum, Patchouli Absolu Eau de Parfum"
Tuscan Leather Eau de Parfum,"Tuscan Leather Travel Atomizer, Tuscan Leather Intense Eau de Parfum, Champaca Absolute Eau de Parfum, Jasmin Rouge Eau de Parfum, Lost Cherry Eau de Parfum"
Aqua Vitae Eau de Toilette,"Coup de Foudre Eau de Parfum, Promesse de l'Aube Eau de Parfum, Danger Parfum Cologne, Tobacco Vanille Travel Atomizer, Ambre Cashmere Intense Eau de Parfum"
Classical Eau de Parfum,"Haxan Eau de Parfum, Sedley Eau de Parfum, Labyrinth Of Spices Extrait de Parfum, Rhinoceros Extrait de Parfum, Fougere Nobile Eau de Parfum"
Java Blossom Attar / perfume oil,"Pichola Eau de Parfum, Forty Thieves Eau de Parfum, Camel Extrait de Parfum, Civet Extrait de Parfum, Precious Oud Eau de Parfum"
Black Sukar Attar / perfume oil,"Oud Stars - Indochine Parfum, Coup de Foudre Eau de Parfum, Oud Maximus Autumn 19 Extrait de Parfum, Enchanted Forest Eau de Parfum, Love Eau de Parfum"
Warda al Oud Attar / perfume oil,"Oud Noir Intense Eau de Parfum, Halfeti Eau de Parfum, Bois d'Oud Eau de Parfum, Wild Rose Aoud Eau de Parfum, Isra & Miraj Eau de Parfum"
Oud Luban Attar / perfume oil,"Coup de Foudre Eau de Parfum, Celestial Eau de Parfum, Pas Ce Soir Eau de Parfum, Rhodanthe Eau de Parfum, Odeur Du Theatre Du Chatelet Acte 1 Eau de Toilette"
Jeke Parfum Extrait,"Gheorghe Eau de Parfum, New York Intense Eau de Parfum, Jubilation XXV Eau de Parfum, Comme Un Carrousel Eau de Parfum, Haxan Eau de Parfum"
Norne Parfum Extrait,"Thurible Eau de Parfum, L'Homme Sage Eau de Parfum, Christopher Street Eau de Parfum, Trayee Eau de Parfum, Relique d'Amour Eau de Parfum"
Ore Parfum Extrait,"Reve en Cuir Eau de Parfum, Coup de Foudre Eau de Parfum, Tobacco Vanille Travel Atomizer, Vanille Fatale Eau de Parfum, Royal Princess Oud Eau de Parfum"
Intense Cafe Eau de Parfum,"Ristretto Intense Cafe Extrait de Parfum, Grape Pearls Eau de Parfum, New York Eau de Parfum, MEM Eau de Parfum, Silver Ombre Eau de Parfum"
Playing with the Devil Eau de Parfum,"L'Aimee Eau de Parfum, Coup de Foudre Eau de Parfum, Mohur Eau de Parfum, Kolonya Eau de Toilette, Empressa Eau de Toilette"
Coccobello Eau de Parfum,"Poudre de Riz Eau de Parfum, Chameleon Eau de Parfum, Interlude Black Iris Eau de Parfum, Hili Eau de Parfum, MEM Eau de Parfum"
1899 - Ernest Hemingway Eau de Parfum,"1899 Travel Spray Eau de Parfum, Kolonya Eau de Toilette, Civet Extrait de Parfum, New York Eau de Parfum, Vixere Eau de Parfum"
Standard Eau de Toilette,"Cio Cio San Eau de Parfum, 2018 Roxo Tonic Eau de Parfum, Rhodanthe Eau de Parfum, Naga Layyen Organic Oud Pure Oud, Fate Man Eau de Parfum"
Almost Transparent Blue Eau de Toilette,"Serpentine Eau de Toilette, Terralba Eau de Parfum, LiquidNight Eau de Parfum, 1979 New Wave Eau de Parfum, 20 Years Eau de Parfum"
Rouge Assassin,"Poudre de Riz Eau de Parfum, Mohur Extrait Parfum Extrait, Mohur Eau de Parfum, L'Aimee Eau de Parfum, Taklamakan Eau de Parfum"
Knize Forest Eau de Toilette,"Kolonya Eau de Toilette, Scandal Parfum Cologne, Knize Ten Golden Edition Eau de Toilette, Knize Ten Eau de Toilette, Oliver Eau de Parfum"
Champaca Eau de Toilette,"Coup de Foudre Eau de Parfum, Capri Eau de Parfum, Sartorial Eau de Toilette, Homa Parfum, Prends-Moi Eau de Parfum"
Acqua Decima Eau de Toilette,"Limon de Cordoza Eau de Toilette, Grand Neroli Cologne Absolue, Nio Eau de Parfum, Vetiver Nocturne Absolu Extrait de Parfum, Scandal Parfum Cologne"
Orangers en Fleurs Eau de Parfum,"Pichola Eau de Parfum, Coup de Foudre Eau de Parfum, Elixir Pour Femme Extrait de Parfum, Kolonya Eau de Toilette, Diaghilev Extrait de Parfum"
Lys 41 Eau de Parfum,"Lys 41 Perfume Oil, Mohur Extrait Parfum Extrait, Trayee Eau de Parfum, Rules of Attraction Extrait de Parfum, Une Nuit Magnetique Eau de Parfum"
Ylang 49 Eau de Parfum,"Mandarava Extrait de Parfum, Diaghilev Extrait de Parfum, L'Aimee Eau de Parfum, Charade Extrait de Parfum, Kolonya Eau de Toilette"
Rose 31 Eau de Parfum,"Rose 31 Perfume Oil, Vetiver 46 Eau de Parfum, Vetiver 46 Perfume Oil, Elysium Parfum Cologne, Vetiver Parfum Cologne"
Glorious Eau de Parfum,"Red Tobacco Eau de Parfum, Halfeti Eau de Parfum, Bois d'Oud Eau de Parfum, Mon Nom Est Rouge Eau de Parfum, L'Aimee Eau de Parfum"
Mousse II Eau de Parfum,"Fusion Sacree - Obscur Eau de Parfum, Trayee Eau de Parfum, Scandal Parfum Cologne, Santal Eau de Toilette, Aurore Nomade Eau de Parfum"
Resina Eau de Parfum,"Coup de Foudre Eau de Parfum, Mandarava Extrait de Parfum, Mysterious Oud Extrait de Parfum, Reve d'Ossian Eau de Parfum, Taklamakan Eau de Parfum"
Vetiverus Eau de parfum,"Jubilation XXV Eau de Parfum, Kinski Eau de Toilette, New York Intense Eau de Parfum, Oliver Eau de Parfum, Diaghilev Extrait de Parfum"
Hedonist Eau de Parfum,"L'Aimee Eau de Parfum, Diaghilev Extrait de Parfum, Ashoka Eau de Parfum, Hedonist Absolute Eau de Parfum, Kolonya Eau de Toilette"
Bay Rum Cologne,"Amber Flush Body Oil Scented Body Oil, Rose Delight Body Oil Scented Body Oil, Eau de Soleil Blanc Eau de Toilette, Sole di Positano Eau de Parfum, Patchouli Absolu Eau de Parfum"
Gold Rose Oudh Extrait de Parfum,"Tokyo Eau de Parfum, Mohur Eau de Parfum, Oud Dream Eau de Parfum, Empressa Eau de Toilette, Taklamakan Eau de Parfum"
Les Jeux Sont Faits Eau de Parfum,"Oud Palao Eau de Parfum, Hili Eau de Parfum, Mon Nom Est Rouge Eau de Parfum, Bombay Bling Eau de Parfum, Gheorghe Eau de Parfum"
Coal Eau de Parfum,"FRANK No. 1 Eau de Parfum, Al Oudh Eau de Parfum, Ormonde Man Eau de Parfum, Upper Ten Eau de Parfum, Shazam! Eau de Parfum"
Gothic II - Perfume Oil Roll-on perfume oil,"Gothic II - Eau de Parfum, Gothic I - Perfume Oil Roll-on perfume oil, Gothic I - Eau de Parfum, Black Amber, Tubereuse Imperiale Eau de Parfum"
Gothic II - Eau de Parfum,"Gothic II - Perfume Oil Roll-on perfume oil, Gothic I - Perfume Oil Roll-on perfume oil, Gothic I - Eau de Parfum, Black Amber, Tubereuse Imperiale Eau de Parfum"
Gothic I - Perfume Oil Roll-on perfume oil,"Gothic I - Eau de Parfum, Gothic II - Perfume Oil Roll-on perfume oil, Gothic II - Eau de Parfum, Chameleon Eau de Parfum, Cafe Tuberosa Cologne Absolue"
Gothic I - Eau de Parfum,"Gothic I - Perfume Oil Roll-on perfume oil, Gothic II - Perfume Oil Roll-on perfume oil, Gothic II - Eau de Parfum, Chameleon Eau de Parfum, Cafe Tuberosa Cologne Absolue"
Gothic III - Perfume Oil Roll-on perfume oil,"Gothic III - Eau de Parfum, Lust in Paradise X Reine Paradis Eau de Parfum, Villa Nellcote Eau de Parfum, Chronic Eau de Parfum, Parisian Oud Eau de Parfum"
Gothic III - Eau de Parfum,"Gothic III - Perfume Oil Roll-on perfume oil, Lust in Paradise X Reine Paradis Eau de Parfum, Villa Nellcote Eau de Parfum, Chronic Eau de Parfum, Parisian Oud Eau de Parfum"
Private Label Eau de Parfum,"Diaghilev Extrait de Parfum, Vetiver Royal Bourbon Eau de Parfum, Interlude Black Iris Eau de Parfum, French Bouquet Eau de Parfum, L'Etre Aime - Homme Eau de Parfum"
La Liturgie des Heures Eau de Parfum,"Sancti Eau de Parfum, Rock Crystal Eau de Parfum, Forest Eau de Parfum, Black I Parfum Extrait, Christopher Street Eau de Parfum"
Psychedelique Eau de Parfum,"Mon Nom Est Rouge Eau de Parfum, Ardent Eau de Parfum, New York Eau de Parfum, MEM Eau de Parfum, Taklamakan Eau de Parfum"
Ambre Premier Eau de Parfum,"L'Aimee Eau de Parfum, New York Intense Eau de Parfum, Shaft of Light Eau de Parfum, Bois d'Oud Eau de Parfum, Empressa Eau de Toilette"
Flash Back Eau de Parfum,"Kolonya Eau de Toilette, Nio Eau de Parfum, L'Aimee Eau de Parfum, Greek Keys Extrait de Parfum, Oliver Eau de Parfum"
Lumiere Blanche Eau de Parfum,"If by RK Eau de Parfum, Feb. 14, 1912 Eau de Parfum, Tango Eau de Parfum, 21 Eau de Parfum, Mohur Extrait Parfum Extrait"
Autoportrait Eau de Parfum,"Trayee Eau de Parfum, L'homme infini Eau de Parfum, L'Aimee Eau de Parfum, Sancti Eau de Parfum, Gin Fizz Eau de Toilette"
Chambre Noire Eau de Parfum,"Gold Incense Eau de Parfum, Velvet Fantasy Eau de Parfum, New York Eau de Parfum, Panthea Eau de Parfum, Mohur Extrait Parfum Extrait"
Still Life Eau de Parfum,"Haxan Eau de Parfum, Villa Nellcote Eau de Parfum, Eshu Extrait, Venom of Angel Eau de Parfum, Mon Nom Est Rouge Eau de Parfum"
Labdanum 18 Eau de Parfum,"Labdanum 18 Perfume Oil, 20 Mars 2022 Eau de Parfum, Gheorghe Eau de Parfum, Gold Extrait de Parfum, Taklamakan Eau de Parfum"
Fleur D'Oranger 27 Eau de Parfum,"Bergamote 22 Eau de Parfum, Bergamote 22 Perfume Oil, Fleur D'Oranger 27 Perfume Oil, Kolonya Eau de Toilette, Elite Eau de Toilette"
Neroli 36 Eau de Parfum,"Neroli 36 Perfume Oil, Vixere Eau de Parfum, Oud Maximus Autumn 19 Extrait de Parfum, Versilia Aurum Eau de Parfum, Citrus Riviera Eau de Parfum"
Jasmin 17 Eau de Parfum,"Jasmin 17 Perfume Oil, Majaina Sin Eau de Parfum, Shaft of Light Eau de Parfum, Empressa Eau de Toilette, Freckled and Beautiful Eau de Parfum"
Vetiver 46 Eau de Parfum,"Vetiver 46 Perfume Oil, 21 Eau de Parfum, Rose 31 Eau de Parfum, Rose 31 Perfume Oil, Taklamakan Eau de Parfum"
Bergamote 22 Eau de Parfum,"Bergamote 22 Perfume Oil, Kolonya Eau de Toilette, Perdizione Eau de Parfum, Elite Eau de Toilette, Fleur D'Oranger 27 Eau de Parfum"
Oud Silk Mood - Extrait de Parfum,"Oud Silk Mood - Eau de Parfum, Oud Palao Eau de Parfum, Oud Stars - Indochine Parfum, Mohur Eau de Parfum, Trayee Eau de Parfum"
Flower of Immortality Eau de Parfum,"Messy Sexy Just Rolled Out of Bed Eau de Parfum, Rouge Assassin, Milk Musk Eau de Toilette, L'Aimee Eau de Parfum, Rahat Loukhoum Eau de Parfum"
Oud 27 Eau de Parfum,"Oud 27 Perfume Oil Perfume oil, Rudis Eau de Parfum, Haxan Eau de Parfum, Oud - Eau de Parfum, Al Oudh Eau de Parfum"
Ambrette 9 Eau de Parfum,"Ambrette 9 Perfume Oil, Kira Kira Eau de Parfum, Mohur Extrait Parfum Extrait, AnOther 13 Eau de Parfum, Sticky Cake Eau de Toilette"
Iris 39 Eau de Parfum,"Diaghilev Extrait de Parfum, Morning Muscs Eau de Parfum, Mohur Extrait Parfum Extrait, Amber Aoud Extrait de Parfum, Lyric for Women Eau de Parfum"
Patchouli 24 Eau de Parfum,"Patchouli 24 Perfume Oil, Salome Eau de Parfum, Oud Wood Travel Atomizer, Qatar Extrait de parfum, Oud Wood Body Spray Scented Body Spray"
Aurore Nomade Eau de Parfum,"Trayee Eau de Parfum, Enchanted Forest Eau de Parfum, Fusion Sacree - Obscur Eau de Parfum, Chameleon Eau de Parfum, Or du Serail Eau de Parfum"
La Fille de Berlin Eau de Parfum,"Violette in Love Eau de Toilette, Rhodanthe Eau de Parfum, Villa Nellcote Eau de Parfum, Velvet Fantasy Eau de Parfum, 20 Mars 2022 Eau de Parfum"
La Route d'Emeraude Eau de Parfum,"Pichola Eau de Parfum, Tart's Knicker Drawer Eau de Parfum, L'Aimee Eau de Parfum, Coup de Foudre Eau de Parfum, Shaft of Light Eau de Parfum"
Enchanted Forest Eau de Parfum,"L'Aimee Eau de Parfum, Fusion Sacree - Obscur Eau de Parfum, Kolonya Eau de Toilette, Mysterious Oud Extrait de Parfum, Diaghilev Extrait de Parfum"
Nero Perfume Oil,"Jupiter Eau de Parfum, Bass Solo Eau de Parfum, Fortis Eau de Parfum, Upper Ten Eau de Parfum, Halfeti Eau de Parfum"
Prima T - Eau de Parfum,"Elixir Pour Femme Extrait de Parfum, Elysium Pour Homme Extrait de Parfum, 1872 for Women Eau de Parfum, Velvet Fantasy Eau de Parfum, Exit the King Eau de Parfum"
Musc - Eau de Parfum,"Musc Perfume Oil, Aoud Exclusif Eau de Parfum, Jardin Exclusif Eau de Parfum, Musc Gold Perfume Oil, Musc Gold Extrait Parfum Extrait"
Dark Purple Eau de Parfum,"20 Years Eau de Parfum, XJ Amber Gold & Rose Gold Collection Eau de Parfum, Kolonya Eau de Toilette, Upper Ten Eau de Parfum, Bois d'Oud Eau de Parfum"
Rosae Mundi Eau de Parfum,"Rudis Eau de Parfum, L'Aimee Eau de Parfum, Soleil d'Italie Eau de Parfum, Lavish Parfum, French Affair Eau de Parfum"
Neroli 36 Perfume Oil,"Neroli 36 Eau de Parfum, Vixere Eau de Parfum, Oud Maximus Autumn 19 Extrait de Parfum, Versilia Aurum Eau de Parfum, Citrus Riviera Eau de Parfum"
Opardu Extrait de Parfum,"Orangers en Fleurs Eau de Parfum, Bombay Bling Eau de Parfum, L'Aimee Eau de Parfum, Elixir Pour Femme Extrait de Parfum, Isles Lointaines Eau de Parfum"
Santal 33 Perfume Oil,"Santal 33 Eau de Parfum, Iris 39 Perfume Oil, Oud Wood Travel Atomizer, Ombre Leather Eau de Parfum, Oud Wood Body Spray Scented Body Spray"
Bergamote 22 Perfume Oil,"Bergamote 22 Eau de Parfum, Kolonya Eau de Toilette, Perdizione Eau de Parfum, Elite Eau de Toilette, Fleur D'Oranger 27 Eau de Parfum"
Patchouli 24 Perfume Oil,"Patchouli 24 Eau de Parfum, Salome Eau de Parfum, Oud Wood Travel Atomizer, Qatar Extrait de parfum, Oud Wood Body Spray Scented Body Spray"
Rose 31 Perfume Oil,"Rose 31 Eau de Parfum, Vetiver 46 Eau de Parfum, Vetiver 46 Perfume Oil, Elysium Parfum Cologne, Vetiver Parfum Cologne"
Jasmin 17 Perfume Oil,"Jasmin 17 Eau de Parfum, Majaina Sin Eau de Parfum, Shaft of Light Eau de Parfum, Empressa Eau de Toilette, Freckled and Beautiful Eau de Parfum"
Oud 27 Perfume Oil Perfume oil,"Oud 27 Eau de Parfum, Rudis Eau de Parfum, Haxan Eau de Parfum, Oud - Eau de Parfum, Al Oudh Eau de Parfum"
Ambrette 9 Perfume Oil,"Ambrette 9 Eau de Parfum, Kira Kira Eau de Parfum, Mohur Extrait Parfum Extrait, AnOther 13 Eau de Parfum, Sticky Cake Eau de Toilette"
Labdanum 18 Perfume Oil,"Labdanum 18 Eau de Parfum, 20 Mars 2022 Eau de Parfum, Gheorghe Eau de Parfum, Gold Extrait de Parfum, Taklamakan Eau de Parfum"
Fleur D'Oranger 27 Perfume Oil,"Fleur D'Oranger 27 Eau de Parfum, Bergamote 22 Eau de Parfum, Bergamote 22 Perfume Oil, Kolonya Eau de Toilette, Elite Eau de Toilette"
Vetiver 46 Perfume Oil,"Vetiver 46 Eau de Parfum, 21 Eau de Parfum, Rose 31 Eau de Parfum, Rose 31 Perfume Oil, Taklamakan Eau de Parfum"
Iris 39 Perfume Oil,"Santal 33 Eau de Parfum, Santal 33 Perfume Oil, Mohur Extrait Parfum Extrait, Rahele Eau de Parfum, Ashoka Eau de Parfum"
Lys 41 Perfume Oil,"Lys 41 Eau de Parfum, Mohur Extrait Parfum Extrait, Trayee Eau de Parfum, Rules of Attraction Extrait de Parfum, Une Nuit Magnetique Eau de Parfum"
Black Amber,"Laudano Nero Extrait de Parfum, 20 Mars 2022 Eau de Parfum, Haxan Eau de Parfum, L'Aimee Eau de Parfum, Hindu Kush Eau de Parfum"
Vanilla Marble Eau de Parfum,"Mohur Extrait Parfum Extrait, Mohur Eau de Parfum, L'Aimee Eau de Parfum, Coup de Foudre Eau de Parfum, Ambre Cashmere Intense Eau de Parfum"
Tzora Eau de Parfum,"Kinski Eau de Toilette, Villa Nellcote Eau de Parfum, 9mm Eau de Parfum, Koiame Eau de Parfum, Kolonya Eau de Toilette"
Akkad Eau de Parfum,"21 Eau de Parfum, Empressa Eau de Toilette, Interlude Black Iris Eau de Parfum, Oud Bleu Intense Eau de Parfum, Mohur Extrait Parfum Extrait"
Galaad Eau de Parfum,"Sancti Eau de Parfum, Al Oudh Eau de Parfum, O/E Eau de Parfum, Trayee Eau de Parfum, Jubilation XXV Eau de Parfum"
Cuir Velours Eau de Parfum,"Bois d'Ascese Eau de Parfum, Burning Ben Eau de Parfum, Cigar Rum Intense Extrait de Parfum, Chimaera Extrait de Parfum, Russian Tea Eau de Parfum"
Interlude Man Eau de Parfum,"Interlude Black Iris Eau de Parfum, Interlude Woman, Ma Nishtana Extrait de Parfum, Rhinoceros Extrait de Parfum, Upper Ten Eau de Parfum"
