Perfume,Similar Perfumes
Vanille Banane Eau de Toilette,"Fusion Sacree - Obscur Eau de Parfum, Platino, Corpi Caldi Eau de Parfum, Vanille Exclusive Eau de Parfum, Fleur de Portofino Eau de Parfum"
Bibliotheque Eau de Parfum,"Diaghilev Extrait de Parfum, Love Toxin Extrait de Parfum, Goddess of Love & Perfume Parfum Extrait, Danger Parfum Cologne, Brume du Matin Eau de Parfum"
Impressions de Giverny Eau de Parfum,"Pichola Eau de Parfum, Kolonya Eau de Toilette, Confessions of a Garden Gnome Eau de Parfum, Dolls Eau de Parfum, Perdizione Eau de Parfum"
Oud Vert Intense Eau de Parfum,"Aseel Attar / Perfume Oil, Kolonya Eau de Toilette, Parisian Oud Eau de Parfum, Scandal Parfum Cologne, Wonderwood Eau de Parfum"
No.09 Vallee de Farney - Eau de Parfum,"No.09 Vallee de Farney- Perfume Oil Perfume Oil Roll-On, Kolonya Eau de Toilette, Emir Eau de parfum, Chronic Eau de Parfum, Tokyo Eau de Parfum"
Eau de Soleil Blanc Eau de Toilette,"Soleil Blanc Travel Atomizer, Soleil Blanc Eau de Parfum, Tuscan Leather Intense Eau de Parfum, Soleil Neige Eau de Parfum, Fucking Fabulous Travel Atomizer Eau de Parfum"
Oud - Extrait de Parfum,"Trayee Eau de Parfum, Qatar Extrait de parfum, Mohur Eau de Parfum, Coup de Foudre Eau de Parfum, Noir de Noir Travel Atomizer"
Oud Silk Mood - Eau de Parfum,"French Bouquet Eau de Parfum, Coup de Foudre Eau de Parfum, Oud Silk Mood - Extrait de Parfum, Trayee Eau de Parfum, Areej Attar / Perfume Oil"
No.04 Bois de Balincourt - Eau de Parfum,"No.04 Bois de Balincourt- Perfume Oil Perfume Oil Roll-On, Red Tobacco Eau de Parfum, Thichila Eau de Parfum, Labyrinth Of Spices Extrait de Parfum, Ambre Topkapi Eau de Parfum"
No.05 Kandilli- Perfume Oil Perfume Oil Roll-On,"Tubereuse Imperiale Eau de Parfum, Hili Eau de Parfum, Pichola Eau de Parfum, Maai Eau de Parfum, Bombay Bling Eau de Parfum"
Parisian Oud Eau de Parfum,"Mon Nom Est Rouge Eau de Parfum, Ma Nishtana Extrait de Parfum, Aoud Exclusif Eau de Parfum, Upper Ten Eau de Parfum, Empressa Eau de Toilette"
Fabulous Eau de Parfum,"Fucking Fabulous Travel Atomizer Eau de Parfum, Fabulous Body Spray Scented Body Spray, Patchouli Absolu Eau de Parfum, Neroli Portofino Travel Atomizer, Neroli Portofino Eau de Parfum"
No.04 Bois de Balincourt- Perfume Oil Perfume Oil Roll-On,"No.04 Bois de Balincourt - Eau de Parfum, Red Tobacco Eau de Parfum, New York Intense Eau de Parfum, Thichila Eau de Parfum, Scandal Parfum Cologne"
No.09 Vallee de Farney- Perfume Oil Perfume Oil Roll-On,"No.09 Vallee de Farney - Eau de Parfum, Kolonya Eau de Toilette, Emir Eau de parfum, Chronic Eau de Parfum, Tokyo Eau de Parfum"
No.10 Aboukir- Perfume Oil Perfume Oil Roll-On,"Lavish Parfum, Plein Jeu III-V Extrait de Parfum, Citrus Riviera Eau de Parfum, New York Eau de Parfum, Single Man Eau de Parfum"
Antidris Cassis- Perfume Oil Perfume Oil Roll-On,"Antidris Cassis - Eau de Parfum, Kolonya Eau de Toilette, New York Eau de Parfum, Fougere Nobile Eau de Parfum, Coup de Foudre Eau de Parfum"
No.02 Le Long Fond - Eau de Parfum,"20 Years Eau de Parfum, Patchouli Nobile Eau de Parfum, New York Intense Eau de Parfum, Danger Parfum Cologne, Scandal Parfum Cologne"
Antidris Cassis - Eau de Parfum,"Antidris Cassis- Perfume Oil Perfume Oil Roll-On, Kolonya Eau de Toilette, New York Eau de Parfum, Fougere Nobile Eau de Parfum, Coup de Foudre Eau de Parfum"
Black Gold Eau de Parfum,"Halfeti Eau de Parfum, Mohur Extrait Parfum Extrait, Red Tobacco Eau de Parfum, Ambre Topkapi Eau de Parfum, Isra & Miraj Eau de Parfum"
AnOther 13 Eau de Parfum,"Kira Kira Eau de Parfum, Gaea Eau de Parfum, Hanamizake (Cherry Blossom Sake) Eau de Parfum, Jardin Exclusif Eau de Parfum, Red Tobacco Eau de Parfum"
Vanille Fatale Eau de Parfum,"Tobacco Oud Eau de Parfum, Lost Cherry Eau de Parfum, Noir de Noir Travel Atomizer, Tuscan Leather Intense Eau de Parfum, Tobacco Vanille Travel Atomizer"
Tsuki Eau de Parfum,"New York Eau de Parfum, Sedley Eau de Parfum, Cuir Cuba Intense Eau de Parfum, Eau de Yuzu Eau de Toilette, She Came to Stay Eau de Parfum"
"Feb. 14, 1912 Eau de Parfum","Panthea Eau de Parfum, Vixere Eau de Parfum, L'Aimee Eau de Parfum, Splendiris Eau de Parfum, Diaghilev Extrait de Parfum"
Sasora Parfum,"Kagiroi Parfum, Keman Parfum, Oud Stars - Alexandria III Parfum, Natsumeku Eau de Parfum, Maruyama Eau de Parfum"
Kyara Parfum,"Pink Wood Eau de Parfum, Oud Noir Intense Eau de Parfum, Mohur Extrait Parfum Extrait, 20 Mars 2022 Eau de Parfum, Meraki Eau de Parfum"
Hasunoito Parfum,"Coup de Foudre Eau de Parfum, Mandarava Extrait de Parfum, Oud Maximus Autumn 19 Extrait de Parfum, The Decay Of The Angel Eau de Parfum, Pichola Eau de Parfum"
Akanesasu Eau de Parfum,"Pichola Eau de Parfum, Splendiris Eau de Parfum, French Bouquet Eau de Parfum, L'Aimee Eau de Parfum, Oud Maximus Autumn 19 Extrait de Parfum"
Shiragoromo Parfum,"Keman Parfum, Hasunoito Parfum, Bouquet de Hongrie Eau de Parfum, Wood Jasmin Eau de Parfum, The Decay Of The Angel Eau de Parfum"
Suleyman le Magnifique Eau de Parfum,"Red Tobacco Eau de Parfum, 20 Mars 2022 Eau de Parfum, New York Intense Eau de Parfum, Mandarava Extrait de Parfum, Fatih Sultan Mehmed Eau de Parfum"
Charlatan Eau de Parfum,"Mohur Extrait Parfum Extrait, Mohur Eau de Parfum, Nefs Extrait de Parfum, Jardin Exclusif Eau de Parfum, Mysterious Oud Extrait de Parfum"
Confessions of a Garden Gnome Eau de Parfum,"Elixir Pour Femme Extrait de Parfum, Elysium Pour Homme Extrait de Parfum, Velvet Fantasy Eau de Parfum, 20 Mars 2022 Eau de Parfum, Atlante Extrait de Parfum"
Amber Absolutely Eau de Parfum,"Laudano Nero Extrait de Parfum, Taklamakan Eau de Parfum, New York Intense Eau de Parfum, Kolonya Eau de Toilette, Vain & Naive Extrait de Parfum"
Fatih Sultan Mehmed Eau de Parfum,"Mohur Extrait Parfum Extrait, Suleyman le Magnifique Eau de Parfum, Taklamakan Eau de Parfum, Rhodanthe Eau de Parfum, L'Aimee Eau de Parfum"
Harem Rose Eau de Parfum,"L'Aimee Eau de Parfum, Grace by Grace Coddington Eau de Toilette, Suleyman le Magnifique Eau de Parfum, Eau My Soul Eau de Parfum, Sheiduna Parfum Extrait"
Maduro Eau de Parfum,"Hili Eau de Parfum, Trayee Eau de Parfum, Suleyman le Magnifique Eau de Parfum, Red Tobacco Eau de Parfum, Comme Un Carrousel Eau de Parfum"
Bojnokopff Eau de Parfum,"Fortis Eau de Parfum, Trayee Eau de Parfum, Haxan Eau de Parfum, Jupiter Eau de Parfum, Oud Stars - Alexandria III Parfum"
Slowdive Eau de Parfum,"Citrus Riviera Eau de Parfum, Pichola Eau de Parfum, Comme Un Carrousel Eau de Parfum, Aroon Sawat Eau de Parfum, Bergamotto di Calabria Eau de Parfum"
Baque Parfum Extrait,"PHI Une Rose de Kandahar Eau de Parfum, Hili Eau de Parfum, Fusion Sacree - Obscur Eau de Parfum, Moss Cologne Eau de Parfum, Splendiris Eau de Parfum"
Camel Extrait de Parfum,"Mysterious Oud Extrait de Parfum, Trayee Eau de Parfum, 20 Mars 2022 Eau de Parfum, Thichila Eau de Parfum, Halfeti Eau de Parfum"
Day Dreams Eau de Parfum,"Vixere Eau de Parfum, 1885 Bains Sulfureux Eau de Parfum, Citrus Riviera Eau de Parfum, Hili Eau de Parfum, Pichola Eau de Parfum"
Intense Black Aoud Extrait de Parfum,"Arabians, Amber Aoud Extrait de Parfum, Dark Purple Eau de Parfum, Exit the King Eau de Parfum, Champs Lunaires Eau de Toilette"
Arabians,"Black Gold Eau de Parfum, Halfeti Eau de Parfum, Ambre Topkapi Eau de Parfum, Black Beard Extrait de Parfum, New York Eau de Parfum"
Ummagumma Eau de Parfum,"20 Mars 2022 Eau de Parfum, Gheorghe Eau de Parfum, Al Oudh Eau de Parfum, 21 Eau de Parfum, Mon Nom Est Rouge Eau de Parfum"
Black Vanilla Eau de Parfum,"Jardin Exclusif Eau de Parfum, Diaghilev Extrait de Parfum, Goddess of Love & Perfume Parfum Extrait, L'Aimee Eau de Parfum, Brume du Matin Eau de Parfum"
Red Tobacco Eau de Parfum,"Trayee Eau de Parfum, Halfeti Eau de Parfum, Glorious Eau de Parfum, Epic Woman Eau de Parfum, Jupiter Eau de Parfum"
California Snow Eau de Parfum,"Haxan Eau de Parfum, Carduus Eau de Parfum, French Leather Eau de Parfum, Good Girl Gone Bad Eau de Parfum, L'eau Rare Matale Eau de Toilette"
Warszawa Parfum Extrait,"Haxan Eau de Parfum, Medullary-ray Eau de Parfum, Gold Extrait de Parfum, Danger Parfum Cologne, Splendiris Eau de Parfum"
Not a Perfume Eau de Parfum,"Greek Keys Extrait de Parfum, Leopard Extrait de Parfum, Not A Perfume Superdose Eau de Parfum, Notorious Oud Eau de Parfum, Tihota Eau de Parfum"
Mx. Eau de Parfum,"Mxxx. Extrait de Parfum, 20 Mars 2022 Eau de Parfum, Kolonya Eau de Toilette, Haxan Eau de Parfum, L'Aimee Eau de Parfum"
Monstera Eau de Parfum,"1969 Travel Spray Eau de Parfum, 1969 Eau de Parfum, Vetiver Nocturne Absolu Extrait de Parfum, Nymphaea Caerulea Extrait de Parfum, Aqua Universalis Forte Eau de Parfum"
OroNardo Eau de Parfum,"White Madera Eau de Parfum, Fusion Sacree - Obscur Eau de Parfum, Coup de Foudre Eau de Parfum, Mutheer Attar / Perfume Oil, Mousse Illuminee Eau de Toilette"
Fumabat Eau de Parfum,"Chypre Mousse Eau de Parfum, Haxan Eau de Parfum, Leopard Extrait de Parfum, Danger Parfum Cologne, Kolonya Eau de Toilette"
Aguamadera Eau de Parfum,"Celestial Eau de Parfum, L'homme Accompli Eau de Parfum, Elysium Parfum Cologne, Vetiver Parfum Cologne, Serpentine Eau de Toilette"
Copala Eau de Parfum,"Velvet Fantasy Eau de Parfum, Mango Skin Eau de Parfum, Oud Stars - Indochine Parfum, New York Eau de Parfum, Hili Eau de Parfum"
Attar AT Perfume oil,"No. 1 for Men Eau de Parfum, L'etre Aime - Femme Eau de Parfum, 20 Mars 2022 Eau de Parfum, L'Aimee Eau de Parfum, Aran Parfum"
French Affair Eau de Parfum,"Single Man Eau de Parfum, Rahele Eau de Parfum, Rhodanthe Eau de Parfum, L'Aimee Eau de Parfum, Moss Cologne Eau de Parfum"
Note de Yuzu Eau de Parfum,"New York Eau de Parfum, Black Gold Eau de Parfum, Acqua Decima Eau de Toilette, Gin Fizz Eau de Toilette, Millesime Imperial Eau de Parfum ..."
Dolce Amalfi Eau de Parfum,"Mon Nom Est Rouge Eau de Parfum, Trayee Eau de Parfum, Jupiter Eau de Parfum, Mysterious Oud Extrait de Parfum, Halfeti Eau de Parfum"
Oud Stars - Malesia Eau de Parfum,"Coup de Foudre Eau de Parfum, Versilia Aurum Eau de Parfum, 20 Mars 2022 Eau de Parfum, Tolu Eau de Parfum, London Eau de Parfum"
Oud Stars - Ceylon Eau de Parfum,"Koala Extrait de Parfum, Oud Noir Intense Eau de Parfum, Rhodanthe Eau de Parfum, Coup de Foudre Eau de Parfum, Mysterious Oud Extrait de Parfum"
Cruz Del Sur I Eau de Parfum,"Cigar Rum Intense Extrait de Parfum, Mysterious Oud Extrait de Parfum, Halfeti Eau de Parfum, J'ai Fait Un Reve - Clair Eau de Parfum, Scotch Peat Eau de Parfum"
Cruz Del Sur II Eau de Parfum,"Deja le Printemps Eau de Parfum, Dolls Eau de Parfum, White Madera Eau de Parfum, J'ai Fait Un Reve - Clair Eau de Parfum, Nio Eau de Parfum"
Oud Stars - Alexandria II Eau de Parfum,"Oud Stars - Alexandria III Parfum, MEM Eau de Parfum, Elixir Pour Femme Extrait de Parfum, 20 Mars 2022 Eau de Parfum, L'Aimee Eau de Parfum"
Birch Eau de Parfum,"United Arab Emirates Aoud Extrait de Parfum, New York Eau de Parfum, If by RK Eau de Parfum, Ani Extrait de Parfum, Myrrh Casati Eau de Parfum"
Beach Hut Man Eau de Parfum,"Deja le Printemps Eau de Parfum, Christopher Street Eau de Parfum, Royal Sapphire Extrait de Parfum, Gin Fizz Eau de Toilette, La Belle Helene Eau de Parfum"
Bruma Eau de Parfum,"20 Mars 2022 Eau de Parfum, Haxan Eau de Parfum, Fougere Nobile Eau de Parfum, Coup de Foudre Eau de Parfum, Kolonya Eau de Toilette"
II (Deux) Eau de Parfum,"Forest Eau de Parfum, Capri Eau de Parfum, Journey Man Eau de Parfum, Escentric 05 - Travel Spray Eau de Toilette, O/E Eau de Parfum"
Mortel Eau de Parfum,"Endymion Cologne, Homa Parfum, L'homme infini Eau de Parfum, Ma Nishtana Extrait de Parfum, Tyrannosaurus Rex Extrait de Parfum"
Olim Eau de Parfum,"Kolonya Eau de Toilette, New York Eau de Parfum, Petra Eau de Parfum, Rhodanthe Eau de Parfum, Ani Extrait de Parfum"
Revolution Eau de Parfum,"Haxan Eau de Parfum, J'ai Fait Un Reve - Clair Eau de Parfum, Mon Nom Est Rouge Eau de Parfum, Trayee Eau de Parfum, Jupiter Eau de Parfum"
Oud Satin Mood Extrait Extrait de Parfum,"Oud Satin Mood Eau de Parfum, Mohur Extrait Parfum Extrait, Orchidee Vanille Eau de Parfum, Oud Stars - Indochine Parfum, I Love YY"
Woman in Gold Eau de Parfum,"Black Beard Extrait de Parfum, New York Eau de Parfum, PHI Une Rose de Kandahar Eau de Parfum, Luxor Oud, Fougere Royale Eau de Parfum"
Gold Knight Eau de Parfum,"PHI Une Rose de Kandahar Eau de Parfum, Knize Ten Eau de Toilette, Isra & Miraj Eau de Parfum, La Danza delle Libellule Eau de Parfum, Hili Eau de Parfum"
Eau My Soul Eau de Parfum,"New York Eau de Parfum, L'Aimee Eau de Parfum, Kolonya Eau de Toilette, Lyric for Women Eau de Parfum, Taklamakan Eau de Parfum"
Berlin Eau de Parfum,"Villa Nellcote Eau de Parfum, No.09 Vallee de Farney - Eau de Parfum, No.09 Vallee de Farney- Perfume Oil Perfume Oil Roll-On, Mx. Eau de Parfum, O/E Eau de Parfum"
Pink Wood Eau de Parfum,"Mon Nom Est Rouge Eau de Parfum, Parisian Oud Eau de Parfum, United Arab Emirates Aoud Extrait de Parfum, Exit the King Eau de Parfum, Puritas Eau de Parfum"
El Cosmico Eau de Parfum,"L'Homme Sage Eau de Parfum, Relique d'Amour Eau de Parfum, Odoon Extrait de Parfum, Issara Extrait de Parfum, Chypre Mousse Eau de Parfum"
"O, Unknown! Eau de Parfum","Taklamakan Eau de Parfum, Ambre Cashmere Intense Eau de Parfum, Koala Extrait de Parfum, Haxan Eau de Parfum, Coup de Foudre Eau de Parfum"
Ambra Extrait de Parfum,"Ligno Extrait de Parfum, Istanbul Eau de Parfum, Sheiduna Parfum Extrait, PHI Une Rose de Kandahar Eau de Parfum, Lyric for Women Eau de Parfum"
Cafe Tuberosa Cologne Absolue,"Regio Eau de Parfum, Sensual Instinct Eau de Parfum, Fleur de Portofino Eau de Parfum, Isra & Miraj Eau de Parfum, Oud Noir Intense Eau de Parfum"
My Own Private Teahupo'o Eau de Parfum,"Chameleon Eau de Parfum, Freckled and Beautiful Eau de Parfum, Mohur Extrait Parfum Extrait, Mon Nom Est Rouge Eau de Parfum, Mohur Eau de Parfum"
Kai Rose - Eau de Parfum Eau de Parfum Spray,"Kai Rose - Perfume Oil Roll-on Perfume Oil, Loukhoum Eau de Parfum, Black IV Parfum Extrait, 1969 Travel Spray Eau de Parfum, 1969 Eau de Parfum"
Mosaic Eau de Parfum,"Velvet Amber, Amber Cologne Eau de Parfum, Qatar Extrait de parfum, Lux Eau de Parfum, No. 1 for Women Eau de Parfum"
Elysium Pour Homme Extrait de Parfum,"Coup de Foudre Eau de Parfum, Danger Parfum Cologne, Scandal Parfum Cologne, MEM Eau de Parfum, 20 Mars 2022 Eau de Parfum"
Velvet Haze Eau de Parfum,"Elephant Extrait de Parfum, Gaea Eau de Parfum, Love Kills Eau de Parfum, Chameleon Eau de Parfum, Fiore d'Ulivo Eau de Parfum"
Suede Osmanthe Eau de Parfum,"Boronia Eau de Parfum, Meraki Eau de Parfum, Villa Nellcote Eau de Parfum, La Belle Helene Eau de Parfum, Koala Extrait de Parfum"
Patchouli Sublime Elixir de Parfum,"New York Eau de Parfum, Black Beard Extrait de Parfum, Fougere Nobile Eau de Parfum, Mon Nom Est Rouge Eau de Parfum, SM Cafe Eau de Parfum"
Tubereuse Absolue Eau de Parfum,"Pichola Eau de Parfum, Fusion Sacree - Obscur Eau de Parfum, Kolonya Eau de Toilette, Dryad Eau de Parfum, Queen Of The Night Eau de Parfum"
Elephant Extrait de Parfum,"Chameleon Eau de Parfum, Hili Eau de Parfum, Mohur Extrait Parfum Extrait, Trayee Eau de Parfum, Against Nature Eau de Parfum"
Layton EXCLUSIF Eau de Parfum,"Empressa Eau de Toilette, New York Eau de Parfum, MEM Eau de Parfum, Mon Nom Est Rouge Eau de Parfum, Kolonya Eau de Toilette"
Oud Wood Intense Eau de Parfum,"Tobacco Oud Intense Eau de Parfum, Neroli Portofino Travel Atomizer, Oud Wood Travel Atomizer, Costa Azzurra Acqua Eau de Toilette, Oud Wood Body Spray Scented Body Spray"
Patch Flash Eau de Parfum,"Mohur Eau de Parfum, Petra Eau de Parfum, Mohur Extrait Parfum Extrait, Shihan Eau de Parfum, Tendre est la Nuit Eau de Parfum"
Figment Man Eau de Parfum,"Mon Nom Est Rouge Eau de Parfum, Coup de Foudre Eau de Parfum, Elysium Parfum Cologne, Vetiver Parfum Cologne, Chameleon Eau de Parfum"
Champs de Provence Eau de Parfum,"Royal Elixir Parfum, Kolonya Eau de Toilette, Nuda Veritas Eau de Parfum, Ambre Royal Eau de Parfum, Bois d'Oud Eau de Parfum"
Sunny Side Up Eau de Parfum,"Geza Schoen Eau de Toilette, Escentric 05 - Travel Spray Eau de Toilette, Mohur Extrait Parfum Extrait, Escentric 05 Eau de Toilette, L'Aimee Eau de Parfum"
Monsieur Beauregard Eau de Parfum,"Mon Nom Est Rouge Eau de Parfum, Coup de Foudre Eau de Parfum, Ambre Cashmere Intense Eau de Parfum, Mohur Eau de Parfum, 20 Mars 2022 Eau de Parfum"
The Uncompromising Sohan Eau de Parfum,"20 Mars 2022 Eau de Parfum, Amber Room Eau de Parfum, Cuir Garamante Eau de Parfum, Trayee Eau de Parfum, Haxan Eau de Parfum"
The Bewitching Yasmine Eau de Parfum,"Trayee Eau de Parfum, Amber Cologne Eau de Parfum, Oud Maximus Autumn 19 Extrait de Parfum, Sensual Instinct Eau de Parfum, Gold Incense Eau de Parfum"
The Ruthless Countess Dorothea Eau de Parfum,"Jasmin Rouge Eau de Parfum, 21 Eau de Parfum, If by RK Eau de Parfum, Winter Palace Eau de Parfum, Elixir Pour Femme Extrait de Parfum"
Vetyverio - Eau de Parfum,"Magnolia Grandiflora - Michel Eau de Parfum, L'Aimee Eau de Parfum, Oliver Eau de Parfum, Delina Hair Mist, Berlin Eau de Parfum"
Aventus For Her Eau de Parfum,"Empressa Eau de Toilette, Against Nature Eau de Parfum, Vixere Eau de Parfum, L'Aimee Eau de Parfum, Ani Extrait de Parfum"
Baccarat Rouge 540 Extrait Extrait de Parfum,"J'ai Fait Un Reve - Obscur Eau de Parfum, Ambre Stone Eau de Parfum, Trayee Eau de Parfum, Qatar Extrait de parfum, Amber Aoud Extrait de Parfum"
Histoire D'Orangers Eau de Parfum,"Sartorial Eau de Toilette, Milk Musk Eau de Toilette, Sel d'Argent Eau de Parfum, Citrus Riviera Eau de Parfum, Rouge Smoking Eau de Parfum"
Au Bord De L'Eau Eau de Cologne,"Knize Ten Eau de Toilette, Vixere Eau de Parfum, Neroli Portofino Travel Atomizer, Kolonya Eau de Toilette, 1885 Bains Sulfureux Eau de Parfum"
Scarlet Lily Eau de Parfum,"MEM Eau de Parfum, Asphalt Rainbow Scratch & Sniff Sticker Set, Asphalt Rainbow Eau de Parfum, Vixere Eau de Parfum, Lili Laa Eau de Parfum"
Delina Eau de Parfum,"Delina Hair Mist, L'Aimee Eau de Parfum, Dendera Extrait de Parfum, Scandal Parfum Cologne, Tyrannosaurus Rex Extrait de Parfum"
10 AM Accord Eau de Parfum,"Haxan Eau de Parfum, Rhinoceros Extrait de Parfum, FRANK No. 1 Eau de Parfum, Bluff, Limited 71 Intense Eau de Parfum"
The Cora Eau de Parfum,"L'Aimee Eau de Parfum, 1804 George Sand Eau de Parfum, MEM Eau de Parfum, Versilia Aurum Eau de Parfum, Goddess of Love & Perfume Parfum Extrait"
Mandala Eau de Parfum,"Mysterious Oud Extrait de Parfum, Ma Nishtana Extrait de Parfum, Dendera Extrait de Parfum, Labyrinth Of Spices Extrait de Parfum, Trayee Eau de Parfum"
Qatar Extrait de parfum,"Scandal Parfum Cologne, Diaghilev Extrait de Parfum, Coup de Foudre Eau de Parfum, Danger Parfum Cologne, Elixir Pour Femme Extrait de Parfum"
Nuit de Bakelite Eau de Parfum,"Haxan Eau de Parfum, Chimaera Extrait de Parfum, Warszawa Parfum Extrait, Qatar Extrait de parfum, Diaghilev Extrait de Parfum"
Neroli Ad Astra Eau de Parfum,"Kolonya Eau de Toilette, Bergamotto di Calabria Eau de Parfum, Azemour les Orangers Eau de Parfum, New York Eau de Parfum, Chameleon Eau de Parfum"
Midnight Special Eau de Parfum,"20 Mars 2022 Eau de Parfum, Rhodanthe Eau de Parfum, Coup de Foudre Eau de Parfum, Amber Intense Eau de Parfum, Moth Extrait de Parfum"
Suede de Suede Eau de Parfum,"20 Mars 2022 Eau de Parfum, Cannabis Blue Eau de Parfum, Tendre est la Nuit Eau de Parfum, Ashoka Eau de Parfum, Purple Haze Eau de Parfum"
Dojima Eau de Parfum,"Haxan Eau de Parfum, Mohur Eau de Parfum, L'Aimee Eau de Parfum, Oliver Eau de Parfum, Dendera Extrait de Parfum"
Vitrum Extrait de Parfum,"Kolonya Eau de Toilette, Tokyo Eau de Parfum, United Arab Emirates Aoud Extrait de Parfum, Civet Extrait de Parfum, Nuwa Extrait de Parfum"
Bond-T Extrait de Parfum,"20 Mars 2022 Eau de Parfum, Gheorghe Eau de Parfum, L'Aimee Eau de Parfum, Divine Vanille Eau de Parfum, Gold Extrait de Parfum"
Naias Extrait de Parfum,"Precision & Grace Eau de Parfum, Jardin Exclusif Eau de Parfum, Rahele Eau de Parfum, Mohur Extrait Parfum Extrait, Vixere Eau de Parfum"
Osmanthus Eau de Parfum,"Osmanthus Elixir Parfum, Elysium Pour Homme Extrait de Parfum, 20 Mars 2022 Eau de Parfum, Ashoka Eau de Parfum, Haxan Eau de Parfum"
Ta'if Eau de Parfum,"Ta'if Elixir Parfum, Kolonya Eau de Toilette, Terra Mia Eau de Parfum, Forty Thieves Eau de Parfum, Mysterious Oud Extrait de Parfum"
Tolu Eau de Parfum,"Versilia Aurum Eau de Parfum, Coup de Foudre Eau de Parfum, Oud Stars - Malesia Eau de Parfum, 20 Mars 2022 Eau de Parfum, L'Aimee Eau de Parfum"
Montabaco - Parfum,"Montabaco - Intensivo, Oliver Eau de Parfum, Nawab of Oudh - Intensivo, Pichola Eau de Parfum, Scandal Parfum Cologne"
Montabaco - Intensivo,"Montabaco - Parfum, Oliver Eau de Parfum, Nawab of Oudh - Intensivo, Pichola Eau de Parfum, Scandal Parfum Cologne"
Nawab of Oudh - Intensivo,"Montabaco - Parfum, Montabaco - Intensivo, Pichola Eau de Parfum, Jubilation XXV Eau de Parfum, New York Intense Eau de Parfum"
Qi - Intensivo,"Koiame Eau de Parfum, Villa Nellcote Eau de Parfum, Precision & Grace Eau de Parfum, Two Eau de Toilette, Impressions de Giverny Eau de Parfum"
Ambre Royal Eau de Parfum,"Royal Elixir Parfum, Halfeti Eau de Parfum, Taklamakan Eau de Parfum, L'Aimee Eau de Parfum, Vain & Naive Extrait de Parfum"
Champaca Eau de Parfum,"Coup de Foudre Eau de Parfum, Qi - Intensivo, Oeillet Louis XV Eau de Parfum, Tubereuse - Les Nombres d'Or Eau de Parfum, Love Eau de Parfum"
Frangipani Eau de Parfum,"Ramune (Japanese Soda) Eau de Parfum, Bois d'Oud Eau de Parfum, Versilia Aurum Eau de Parfum, Gold II Sahara Parfum Extrait, Oud Stars - Alexandria III Parfum"
Isfarkand Eau de Parfum,"Soleil d'Italie Eau de Parfum, Oliver Eau de Parfum, L'Aimee Eau de Parfum, Greek Keys Extrait de Parfum, Elysium Parfum Cologne"
Ormonde Man Eau de Parfum,"Kolonya Eau de Toilette, New York Eau de Parfum, O/E Eau de Parfum, Soleil d'Italie Eau de Parfum, Oud Dream Eau de Parfum"
Ormonde Woman Eau de Parfum,"Ormonde Elixir Parfum, Mohur Eau de Parfum, Trayee Eau de Parfum, Ormonde Man Eau de Parfum, Mohur Extrait Parfum Extrait"
Santo Incienso Extrait de Parfum,"Pikovaya Dama Eau de Parfum, Io Non Ho Mani Che Mi Accarezzino il Volto Extrait de Parfum, Geza Schoen Eau de Toilette, Moss Cologne Eau de Parfum, Cuir Mauresque Eau de Parfum"
Dragonfly Eau de Parfum,"Vixere Eau de Parfum, Hummingbird Extrait de Parfum, Two Eau de Toilette, Majaina Sin Eau de Parfum, Iris Homme Eau de Parfum"
United Arab Emirates Aoud Extrait de Parfum,"Coup de Foudre Eau de Parfum, Kolonya Eau de Toilette, Diaghilev Extrait de Parfum, 20 Mars 2022 Eau de Parfum, Tyrannosaurus Rex Extrait de Parfum"
La Douceur de Siam Eau de Parfum,"Chameleon Eau de Parfum, MEM Eau de Parfum, L'Aimee Eau de Parfum, Elixir Pour Femme Extrait de Parfum, Tyrannosaurus Rex Extrait de Parfum"
Le Sillage Blanc Eau de Parfum,"Oliver Eau de Parfum, Kolonya Eau de Toilette, Salome Eau de Parfum, Christopher Street Eau de Parfum, Diaghilev Extrait de Parfum"
Vespero Parfum Extrait,"Elysium Pour Homme Extrait de Parfum, Kolonya Eau de Toilette, New York Eau de Parfum, Emir Eau de parfum, Villa Nellcote Eau de Parfum"
Santal Complet Eau de Parfum,"Ambre Cashmere Intense Eau de Parfum, Velvet Fantasy Eau de Parfum, Rhodanthe Eau de Parfum, Chameleon Eau de Parfum, Santal Eau de Toilette"
Hacivat Extrait de Parfum,"Halfeti Eau de Parfum, Delma Eau de Parfum, London Oud Eau de Parfum, Goddess of Love & Perfume Parfum Extrait, L'Aimee Eau de Parfum"
Karagoz Extrait de Parfum,"Trayee Eau de Parfum, Black Gold Eau de Parfum, Against Nature Eau de Parfum, Mohur Extrait Parfum Extrait, Red Tobacco Eau de Parfum"
Zenne Extrait de Parfum,"Ani Extrait de Parfum, MEM Eau de Parfum, Bombay Bling Eau de Parfum, Shaft of Light Eau de Parfum, Elysium Pour Homme Extrait de Parfum"
Hundred Silent Ways Extrait de Parfum,"L'Aimee Eau de Parfum, New York Eau de Parfum, Vanille Exclusive Eau de Parfum, Sweet Flowers Eau de Parfum, Diaghilev Extrait de Parfum"
Fan Your Flames Extrait de Parfum,"On The Road Eau de Parfum, Maxed Out Parfum Extrait, Comme Un Carrousel Eau de Parfum, SM Cafe Eau de Parfum, Danger Parfum Cologne"
Afrika-Olifant Extrait de Parfum,"Nocturnal Poetry Parfum, 20 Mars 2022 Eau de Parfum, Jubilation XXV Eau de Parfum, Nectary Eau de Parfum, MEM Eau de Parfum"
Ambra Calabria Extrait de Parfum,"New York Eau de Parfum, Hakka Eau de Parfum, Jardin Exclusif Eau de Parfum, Kolonya Eau de Toilette, Iris Bleu Gris Eau de Parfum"
Sultan Vetiver Extrait de Parfum,"Nio Eau de Parfum, Escale En Haiti Eau De Cologne, New York Eau de Parfum, Kolonya Eau de Toilette, Mysterious Oud Extrait de Parfum"
Suede et Safran Extrait de Parfum,"Jupiter Eau de Parfum, Saringkarn Extrait, Arsalan Parfum, Homa Parfum, Rook Eau de Parfum"
Pachuli Kozha Extrait de Parfum,"Chimaera Extrait de Parfum, United Arab Emirates Aoud Extrait de Parfum, Civet Extrait de Parfum, Baudelaire Eau de Parfum, Thurible Eau de Parfum"
Tuberoza Extrait de Parfum,"Pichola Eau de Parfum, Kolonya Eau de Toilette, Diaghilev Extrait de Parfum, Silver Man Eau de Parfum, Queen Of The Night Eau de Parfum"
A City On Fire Eau de Parfum,"Oud Bleu Intense Eau de Parfum, Scotch Peat Eau de Parfum, Oud Sinharaja Extrait de Parfum, 2 Candle, 2 Eau de Parfum"
Slow Explosions Eau de Parfum,"SM Cafe Eau de Parfum, Pichola Eau de Parfum, Asphalt Rainbow Scratch & Sniff Sticker Set, Asphalt Rainbow Eau de Parfum, La Capitale Parfum"
Saint Julep Eau de Parfum,"Musk Cologne Eau de Parfum, 1 Parfum Extrait, Augusto Eau de Parfum, Phtaloblue Eau de Parfum, Namasoma Organic Oud Pure Oud"
Garage Eau de Toilette,"Danger Parfum Cologne, Reve en Cuir Eau de Parfum, Oud Wood Travel Atomizer, Elysium Pour Homme Extrait de Parfum, Oud Wood Body Spray Scented Body Spray"
Soda Eau de Toilette,"Maxed Out Parfum Extrait, Isfarkand Elixir Parfum, Andy Warhol's You're In Eau de Toilette, Geza Schoen Eau de Toilette, Mousse II Eau de Parfum"
